id,user_id,user_name,game_id,game_name,type,title,viewer_count,started_at,language,thumbnail_url,tag_ids,broadcaster_type,description,type
40488221806,22253819,Scarra,513181,Genshin Impact,live,f2p hitting AR45 today so cracking 40 resin,5091,2020-11-14T22:45:13Z,en,https://static-cdn.jtvnw.net/previews-ttv/live_user_scarra-{width}x{height}.jpg,['6ea6bca4-4712-4ab9-a906-e3336a9d8039'],partner,I'm an ex league of legends pro mid laner turned streamer. Also fps prodigy.,
40489941198,95928197,DemoneKim,513181,Genshin Impact,live,FRIED BOLOGNA AND CHEESE,2039,2020-11-15T00:35:42Z,en,https://static-cdn.jtvnw.net/previews-ttv/live_user_demonekim-{width}x{height}.jpg,"['6ea6bca4-4712-4ab9-a906-e3336a9d8039', 'ff56eeeb-99ed-4a60-93fc-0b3f05d8661e', '6606e54c-f92d-40f6-8257-74977889ccdd']",partner,It's Possible!,
40494015550,30080751,Dyrus,513181,Genshin Impact,live,here we go again,713,2020-11-15T04:11:44Z,en,https://static-cdn.jtvnw.net/previews-ttv/live_user_dyrus-{width}x{height}.jpg,['6ea6bca4-4712-4ab9-a906-e3336a9d8039'],partner,hi dyrus,
40494385886,73362563,Xlice,513181,Genshin Impact,live,AR50 tomoro - 65+ fragile resin hoarder // 36/36 Abyss // !builds,617,2020-11-15T04:31:48Z,en,https://static-cdn.jtvnw.net/previews-ttv/live_user_xlice-{width}x{height}.jpg,"['6ea6bca4-4712-4ab9-a906-e3336a9d8039', '6606e54c-f92d-40f6-8257-74977889ccdd']",partner,Gacha degen // FGO // Arknights // Genshin Impact // Roguelikes,
40491123390,98078101,cakeTuonto,513181,Genshin Impact,live,AR 48 - childe is so fun what the frick,266,2020-11-15T01:40:15Z,en,https://static-cdn.jtvnw.net/previews-ttv/live_user_caketuonto-{width}x{height}.jpg,['6ea6bca4-4712-4ab9-a906-e3336a9d8039'],affiliate,im am slightly illiterate ,
40491319998,40990240,koefficient,513181,Genshin Impact,live,Genshin Impact Finishing The Genshin Impact Story & Boss Fights After!,255,2020-11-15T01:51:01Z,en,https://static-cdn.jtvnw.net/previews-ttv/live_user_koefficient-{width}x{height}.jpg,['6ea6bca4-4712-4ab9-a906-e3336a9d8039'],partner,"I'm a dude who loves to play fighting games and have fun doing it, I also love to play video games in general and see what I can do to try to not play the tutorials of those games :) Anyways you'll find an array of games here and you'll probably see me suck in all of em :) thanks for reading :)",
40486213022,71866497,Legend0fLucky,513181,Genshin Impact,live,Senor 1k celebrates qualifying for summit,254,2020-11-14T20:12:16Z,en,https://static-cdn.jtvnw.net/previews-ttv/live_user_legend0flucky-{width}x{height}.jpg,['6ea6bca4-4712-4ab9-a906-e3336a9d8039'],partner,,
39716286365,53140039,gus_skywalker,513181,Genshin Impact,live,F2Pobre TENTATIVAS PISO 12,183,2020-11-14T23:11:52Z,pt,https://static-cdn.jtvnw.net/previews-ttv/live_user_gus_skywalker-{width}x{height}.jpg,['39ee8140-901a-4762-bfca-8260dea1310f'],partner,twitter.com/gus_skywalkre,
40494721342,84234401,akron_,513181,Genshin Impact,live,ludwig type stream (lol haha) !onlyfans !yt !discord ,179,2020-11-15T04:50:46Z,en,https://static-cdn.jtvnw.net/previews-ttv/live_user_akron_-{width}x{height}.jpg,['6ea6bca4-4712-4ab9-a906-e3336a9d8039'],affiliate,damn daniel,
40494497230,144220751,khunmayo,513181,Genshin Impact,live,สายตาของฉันไม่ชัดเพราะอะไรนะ,177,2020-11-15T04:37:58Z,th,https://static-cdn.jtvnw.net/previews-ttv/live_user_khunmayo-{width}x{height}.jpg,"['f19c7524-c18d-41af-9f39-034c8d0b0fee', '6606e54c-f92d-40f6-8257-74977889ccdd', 'df448da8-7082-45b2-92ad-c624dba6551f']",partner,"Heya, Called ""Khun Mayo"", My stream schedule is afternoon so should prepare if you wake up and see me, see ya.♥",
40489186862,47831185,art1kms,513181,Genshin Impact,live,"46AR Заменит ли Диона Барбару? (Помощь по игре, !промокод)",176,2020-11-14T23:50:57Z,ru,https://static-cdn.jtvnw.net/previews-ttv/live_user_art1kms-{width}x{height}.jpg,"['0569b171-2a2b-476e-a596-5bdfb45a1327', '67259b26-ff83-444e-9d3c-faab390df16f']",affiliate,Френдли стрим на казуальном уровне,
40492451982,9173550,ATK,513181,Genshin Impact,live,점심 원시인 ,175,2020-11-15T02:49:38Z,ko,https://static-cdn.jtvnw.net/previews-ttv/live_user_atk-{width}x{height}.jpg,['ab2975e3-b9ca-4b1a-a93e-fb61a5d5c3a4'],partner,"알버트의 종합게임, 일상 라디오 생방송 채널입니다.                                            방송은 저녁 8시에 주로 킵니다! (가끔 이벤트때, 혹은 렌덤 낮방송 ON)",
40492772382,76317640,FlashTV,513181,Genshin Impact,live,"AR 45 | Xiao, Albedo y .... más cosas que anunciar la noche de hoy, participa en mi comunidad de discord!",164,2020-11-15T03:05:40Z,es,https://static-cdn.jtvnw.net/previews-ttv/live_user_flashtv-{width}x{height}.jpg,['d4bb9c58-2141-4881-bcdc-3fe0505457d1'],partner,No hay límite para nosotros mismos. ,
39992900188,68758534,IvanForeverLife,513181,Genshin Impact,live,RANGO 50 🔥 TARTAGLIA OP 🔥 !COFRES !jugar ,160,2020-11-15T00:02:01Z,es,https://static-cdn.jtvnw.net/previews-ttv/live_user_ivanforeverlife-{width}x{height}.jpg,['d4bb9c58-2141-4881-bcdc-3fe0505457d1'],partner,"Me gustan todos los juegos. Principalmente subo ARK, Fortnite, COD y cualquier modo historia nuevo que mole :)",
39993625244,93029826,FREAKNOFREAK,513181,Genshin Impact,live,Eighth Day Of The Week,159,2020-11-15T03:48:24Z,ru,https://static-cdn.jtvnw.net/previews-ttv/live_user_freaknofreak-{width}x{height}.jpg,"['0569b171-2a2b-476e-a596-5bdfb45a1327', '57e81aba-c8ae-48aa-8fba-7a7eb9d3dd23', '6606e54c-f92d-40f6-8257-74977889ccdd', '2920fbf2-293e-4753-8ec7-b69dba5392d0', 'ac763b17-7bea-4632-9eb4-d106689ff409']",partner,Дмитрий | 24 | Нижний Новгород  | freaknofreak@gmail.com - реклама и сотрудничество.,
39982966108,172266354,hayaku_mtg,513181,Genshin Impact,live,[AR 46] 30h no stop / F2P = try abyss 12 ! / !teamgéo / !code/ !fun1 / !team / Bienvenue à tous :),149,2020-11-14T13:14:09Z,fr,https://static-cdn.jtvnw.net/previews-ttv/live_user_hayaku_mtg-{width}x{height}.jpg,['6f655045-9989-4ef7-8f85-1edcec42d648'],affiliate,"Gamer depuis plus de 20 ans,j'ai une large préférence pour les rpg ou jeu d'action; j'aime les défis et les hard try. Ancien top 1 FR Blademaster sur Blade and soul / ancien top 1 pvp Dragon nest slayer / ancien top 3 paladin europeen FF14 pve solo / .Je vous souhaite à tous bon visionnage ;)  ",
39716392061,121568726,KutieKitten,513181,Genshin Impact,live,♡!giveaway henlo ur cute! ♡ !discord ♡  ,134,2020-11-14T23:26:03Z,en,https://static-cdn.jtvnw.net/previews-ttv/live_user_kutiekitten-{width}x{height}.jpg,['6ea6bca4-4712-4ab9-a906-e3336a9d8039'],partner,Hi my names Layla and I stream everyday!,
40494501678,8614507,Honako,513181,Genshin Impact,live,Genshin Impact,108,2020-11-15T04:38:13Z,en,https://static-cdn.jtvnw.net/previews-ttv/live_user_honako-{width}x{height}.jpg,['6ea6bca4-4712-4ab9-a906-e3336a9d8039'],partner,Video Games,
40492652526,591378004,hinamalina,513181,Genshin Impact,live,gacha hell tempts me. im gonna try get ar 29 ~ vtuber,107,2020-11-15T02:59:58Z,en,https://static-cdn.jtvnw.net/previews-ttv/live_user_hinamalina-{width}x{height}.jpg,"['6ea6bca4-4712-4ab9-a906-e3336a9d8039', '6606e54c-f92d-40f6-8257-74977889ccdd', 'cc8d5abb-39c9-4942-a1ee-e1558512119e']",affiliate,"Hi hi! I'm a Vtuber who likes to draw and play games! If you want to hear me talk about waifus and have lots of fun, tune in! ",
40495014158,54642780,mellign,513181,Genshin Impact,live,[ar38] ar40 soon maybe :'( ,95,2020-11-15T05:07:22Z,en,https://static-cdn.jtvnw.net/previews-ttv/live_user_mellign-{width}x{height}.jpg,"['6ea6bca4-4712-4ab9-a906-e3336a9d8039', '6606e54c-f92d-40f6-8257-74977889ccdd']",affiliate,yeah so like uhhh i can offer u bad gameplay and i'll also cook food on stream for u every now and then,
40490414062,219570186,꿀송이_,513181,Genshin Impact,live,🌸25렙💖아임 늑대헌터🌸,92,2020-11-15T01:02:09Z,ko,https://static-cdn.jtvnw.net/previews-ttv/live_user_nunuu12-{width}x{height}.jpg,['ab2975e3-b9ca-4b1a-a93e-fb61a5d5c3a4'],affiliate,💖안뇽 방가워◝(・ω・)◟💖,
39988581276,136852283,etozheGulman,513181,Genshin Impact,live,На страже твоих лолей. В ожидании шейхов на коробки,82,2020-11-14T19:02:42Z,ru,https://static-cdn.jtvnw.net/previews-ttv/live_user_etozhegulman-{width}x{height}.jpg,"['0569b171-2a2b-476e-a596-5bdfb45a1327', '6606e54c-f92d-40f6-8257-74977889ccdd', 'aeab850d-94ec-4af5-89a0-9eb1bf41558d', '3dc8f084-d886-4264-b20f-8bd5f90562b5', '1e95d7b4-8dac-4b5f-81d5-f963fdc5d989', '8bbdb07d-df18-4f82-a928-04a9003e9a7e']",partner,,
39713398685,71141045,SkojSkull,513181,Genshin Impact,live,[24 HOUR STREAM] [ENG] 💀 ❤️First Ever Charity Stream!! Miss you guys ❤️ | !Charity | !merch,80,2020-11-14T16:03:06Z,en,https://static-cdn.jtvnw.net/previews-ttv/live_user_skojskull-{width}x{height}.jpg,"['6606e54c-f92d-40f6-8257-74977889ccdd', '3ffbec21-97a2-43f9-bd73-4506a1b4d62c', 'ff56eeeb-99ed-4a60-93fc-0b3f05d8661e', 'ac763b17-7bea-4632-9eb4-d106689ff409', '6ea6bca4-4712-4ab9-a906-e3336a9d8039']",affiliate,22 | Half Swedish Weeb | Monster Hunter | Variety,
40490370750,32705587,MercurioBlue,513181,Genshin Impact,live,AR 41 grinding !streamraiders !discord,80,2020-11-15T01:00:14Z,en,https://static-cdn.jtvnw.net/previews-ttv/live_user_mercurioblue-{width}x{height}.jpg,['6ea6bca4-4712-4ab9-a906-e3336a9d8039'],affiliate,"Hi!  I started playing MTG in 1996.   I aim to create a positive, safe, and secure learning environment based on mutual respect.  I enjoy card games and roleplaying games. Currently I am streaming: Eternal, MTGArena, Mythgard, Runeterra, Hades, Genshin Impact.",
40494856126,100729405,AnhthuChan,513181,Genshin Impact,live,[AR 46] degen friendly hours :) | !death,77,2020-11-15T04:58:32Z,en,https://static-cdn.jtvnw.net/previews-ttv/live_user_anhthuchan-{width}x{height}.jpg,['6ea6bca4-4712-4ab9-a906-e3336a9d8039'],affiliate,I love steak and boba c:,
39716244829,152221522,sasazinhaw,513181,Genshin Impact,live,AR41  !loja !prime !exitlag !pius !piu,76,2020-11-14T23:06:32Z,pt,https://static-cdn.jtvnw.net/previews-ttv/live_user_sasazinhaw-{width}x{height}.jpg,['39ee8140-901a-4762-bfca-8260dea1310f'],affiliate,"Oii, eu sou a Sasa! :P To sempre jogando alguma coisa aleatória e batendo papo! Bem vindos! Lives a partir das 20h!! Por favor, leiam as regras! ^^ ",
40494057406,77259927,mkkCH,513181,Genshin Impact,live,[AR49] อยู่บนเขาไม่อบอุ่นเท่าอยู่บนเราหรอก,74,2020-11-15T04:14:03Z,th,https://static-cdn.jtvnw.net/previews-ttv/live_user_mkkch-{width}x{height}.jpg,['f19c7524-c18d-41af-9f39-034c8d0b0fee'],partner,สตีมเมอร์โบ๊ะบ๊ะ เอาแน่เอานอนไม่ได้ แต่เอาได้แน่นอน(เอาอกเอาใจ),
40491369502,27852179,DegenTP,513181,Genshin Impact,live,Genshing stuff and FO76 later | !sc for Stream Raider,73,2020-11-15T01:53:42Z,en,https://static-cdn.jtvnw.net/previews-ttv/live_user_degentp-{width}x{height}.jpg,['6ea6bca4-4712-4ab9-a906-e3336a9d8039'],partner,Check out my YouTube! http://www.youtube.com/user/DegenTP,
39718685341,252548325,Yuuria1,513181,Genshin Impact,live,AR 44 ♥,72,2020-11-15T03:58:00Z,pt,https://static-cdn.jtvnw.net/previews-ttv/live_user_yuuria1-{width}x{height}.jpg,['39ee8140-901a-4762-bfca-8260dea1310f'],affiliate,,
39993544316,71076405,Blaslume,513181,Genshin Impact,live,AR 46 Y deleteamos bosses,71,2020-11-15T02:57:44Z,es,https://static-cdn.jtvnw.net/previews-ttv/live_user_blaslume-{width}x{height}.jpg,['d4bb9c58-2141-4881-bcdc-3fe0505457d1'],affiliate,,
39993627500,140151447,lamaga87,513181,Genshin Impact,live,[PEGI 18] RA 46. Salen unos churros con cafe? SUB = 2 cofres de streamloots.,71,2020-11-15T03:49:51Z,es,https://static-cdn.jtvnw.net/previews-ttv/live_user_lamaga87-{width}x{height}.jpg,['d4bb9c58-2141-4881-bcdc-3fe0505457d1'],affiliate,,
40493188910,487693691,windellia,513181,Genshin Impact,live,"5 sit ups per sub/500bits/$5 dono, pls dont kill me ty",70,2020-11-15T03:27:45Z,en,https://static-cdn.jtvnw.net/previews-ttv/live_user_windellia-{width}x{height}.jpg,"['6ea6bca4-4712-4ab9-a906-e3336a9d8039', '96b6073f-450d-4248-8ed4-988e28f3f759', 'ac763b17-7bea-4632-9eb4-d106689ff409', '8486f56b-8677-44f7-8004-000295391524']",affiliate,Hi! Please don't call me Wind ;c,
40491667886,169238590,라나시란,513181,Genshin Impact,live,[원신/49] 비경 도우미 [덱상담/질문환영],68,2020-11-15T02:07:59Z,ko,https://static-cdn.jtvnw.net/previews-ttv/live_user_jackmackein-{width}x{height}.jpg,['ab2975e3-b9ca-4b1a-a93e-fb61a5d5c3a4'],affiliate,"평일 아침~오후,주말 오후~저녁 오픈하는 모바일게이머",
40492710942,140383069,나옹이빵,513181,Genshin Impact,live,염색해따 ' w')/,61,2020-11-15T03:02:37Z,ko,https://static-cdn.jtvnw.net/previews-ttv/live_user_healer_sham-{width}x{height}.jpg,"['ab2975e3-b9ca-4b1a-a93e-fb61a5d5c3a4', '64d9afa6-139a-48d5-ab4e-51d0a92b22de', 'ffc3eb89-13e8-45cb-907f-4d9eb8f32d43', 'f2d10665-9980-452a-b091-f0ca30777d4b']",affiliate,그림그리며 이야기합니다 :3c 그외에도 이것저것 하는 종합방송!,
40491816926,79202256,Zy0xxx,513181,Genshin Impact,live,[AR 47] Maxing Childe artifacts - F2P acc later??? come chill yes ok woo cool!!!!!,58,2020-11-15T02:15:36Z,en,https://static-cdn.jtvnw.net/previews-ttv/live_user_zy0xxx-{width}x{height}.jpg,['6ea6bca4-4712-4ab9-a906-e3336a9d8039'],affiliate,Previously Evilbaneling - GENSHIN IMPACT GAMER Childe/Diluc main - live most nights,
40487237422,146564362,RyndiaZone,513181,Genshin Impact,live,[AR 44 | JP Audio] Doing Tartaglia's Story Quest :D  | !rescuePH,50,2020-11-14T21:32:20Z,en,https://static-cdn.jtvnw.net/previews-ttv/live_user_ryndiazone-{width}x{height}.jpg,"['cc8d5abb-39c9-4942-a1ee-e1558512119e', '6606e54c-f92d-40f6-8257-74977889ccdd', 'a4fac2cc-7cd4-44a6-b620-178182389a5b', 'd24d8407-b69f-466b-a059-b43ddacd3e7c', '6ea6bca4-4712-4ab9-a906-e3336a9d8039', 'd0976a7e-26a7-4a48-9225-c522808540f2']",partner,"Hi~ I'm Ryndia! I love gaming and singing :3 Welcome to the Zone! We like to chill while enjoying some awesome games and music together! Don't be shy to chat with us any time ♥ P.S. I also love anime, dogs, puns, art, and memes ;D",
40494818510,127192266,denniscyan,513181,Genshin Impact,live,¡Genshin Impact! | Heeeeey | 45 pesosᵐˣ por 10 diamantes con EDGARTCMX en PokeXGames | ,49,2020-11-15T04:56:21Z,es,https://static-cdn.jtvnw.net/previews-ttv/live_user_denniscyan-{width}x{height}.jpg,['d4bb9c58-2141-4881-bcdc-3fe0505457d1'],partner,"¡Hola! Soy Dennis, tengo 23 años y mi contenido principal es Genshin Impact, hacemos también Valorant y Just Chatting... espero te la pases bien por aca y cualquier duda no dudes en preguntar... te amo.",
40495472318,59134494,MattHouston,513181,Genshin Impact,live,Genshin x DMCA Free Day II[AR 44/F2P 42],47,2020-11-15T05:35:29Z,en,https://static-cdn.jtvnw.net/previews-ttv/live_user_matthouston-{width}x{height}.jpg,"['6ea6bca4-4712-4ab9-a906-e3336a9d8039', '325f7a22-26f4-4ad7-be48-f464de0b89ce', '85d2fb8f-7257-4e08-8065-6161fa3029fa', '19320835-e4e5-4561-9105-3517abd87879']",affiliate,I Don't Miss.,
40495117086,184589724,むしゃまる,513181,Genshin Impact,live,【Rascal Jester】原神 rank45~~,46,2020-11-15T05:13:26Z,ja,https://static-cdn.jtvnw.net/previews-ttv/live_user_mushamaru_-{width}x{height}.jpg,['6ba1d230-e52f-4d81-b1e0-41f25a8a9f5d'],partner,RascalJester所属 Name 武者丸(MUSHAMARU)　,
39718621277,235856710,Concept2g,513181,Genshin Impact,live,New Friends Welcome | New Childe Guide !childe !youtube !discord,45,2020-11-15T03:49:14Z,en,https://static-cdn.jtvnw.net/previews-ttv/live_user_concept2g-{width}x{height}.jpg,"['6ea6bca4-4712-4ab9-a906-e3336a9d8039', '64d9afa6-139a-48d5-ab4e-51d0a92b22de', '67259b26-ff83-444e-9d3c-faab390df16f', 'cea7bc0c-75a5-4446-8743-6db031b71550', 'e90b5f6e-4c6e-4003-885b-4d0d5adeb580', '6606e54c-f92d-40f6-8257-74977889ccdd']",affiliate,Fischl DPS abuser. ,
40494314254,207692263,ADULTINDYz,513181,Genshin Impact,live,นอนจนคิดว่าตายไปแล้ว 5555,45,2020-11-15T04:27:59Z,th,https://static-cdn.jtvnw.net/previews-ttv/live_user_adultindyz-{width}x{height}.jpg,['f19c7524-c18d-41af-9f39-034c8d0b0fee'],partner,อีกหนึ่งช่องจาก PLM Streamer สายซาเวจ สกิลยิงระดับกาก สกิลปากระดับโลก ใครชอบคนบ้าๆ คนเถื่อนๆ เข้ามาดู,
39993653132,109359780,MissFeelGood,513181,Genshin Impact,live,"[AR44] Wolfi, Drachen, PastaBoY klatschen! Bitte einmal geilen Loot! Danke!! :D",41,2020-11-15T04:07:54Z,de,https://static-cdn.jtvnw.net/previews-ttv/live_user_missfeelgood-{width}x{height}.jpg,['9166ad14-41f1-4b04-a3b8-c8eb838c6be6'],affiliate,"I love Games; On/Offline. Weder Pro, noch Casual. Dabei &  in allen Lebenslagen oftmals ziemlich Talentfrei x)",
40494909742,119491028,jenbunbunn,513181,Genshin Impact,live,pls be nice (first rpg),40,2020-11-15T05:01:22Z,en,https://static-cdn.jtvnw.net/previews-ttv/live_user_jenbunbunn-{width}x{height}.jpg,['6ea6bca4-4712-4ab9-a906-e3336a9d8039'],affiliate,I play animal crossing and genshin impact :),
40490142702,183121994,doomsdaygal,513181,Genshin Impact,live,AR 38. more genshin grind kekw,39,2020-11-15T00:47:33Z,en,https://static-cdn.jtvnw.net/previews-ttv/live_user_doomsdaygal-{width}x{height}.jpg,['6ea6bca4-4712-4ab9-a906-e3336a9d8039'],affiliate,"Doomie is a Canadian variety streamer who has been playing a lot of ACNH, Valorant, TFT, and DBD. She's also a graphic / animation overlay designer.",
40494602094,125467843,thatcmonster,513181,Genshin Impact,live,"Genshin Community Night, maybe Hades after",36,2020-11-15T04:43:52Z,en,https://static-cdn.jtvnw.net/previews-ttv/live_user_thatcmonster-{width}x{height}.jpg,"['6ea6bca4-4712-4ab9-a906-e3336a9d8039', '8bbdb07d-df18-4f82-a928-04a9003e9a7e', 'eaba0ad7-c4e1-4878-b37f-01308dbb65c8', '6606e54c-f92d-40f6-8257-74977889ccdd', '06ab147d-91b6-4c7f-83e4-2b337d2780d5', 'd24d8407-b69f-466b-a059-b43ddacd3e7c']",affiliate,Live Voice Acting and Video Games!  (Also sharks) ,
40493936574,43400174,LordAshura_,513181,Genshin Impact,live,Genshin Grinding with Friends !guide,35,2020-11-15T04:07:28Z,en,https://static-cdn.jtvnw.net/previews-ttv/live_user_lordashura_-{width}x{height}.jpg,"['6ea6bca4-4712-4ab9-a906-e3336a9d8039', '6606e54c-f92d-40f6-8257-74977889ccdd']",affiliate,I create Guides and Play Fate/Grand Order along with other Gacha Games.Check out my Guides and Content at: https://www.kscopedia.net/,
40493417006,67603703,Zeenigami,513181,Genshin Impact,live,"🔴AR45! Later, Jujutsu Kaisen Watch Party on Discord! [Closed Captions]",35,2020-11-15T03:39:51Z,en,https://static-cdn.jtvnw.net/previews-ttv/live_user_zeenigami-{width}x{height}.jpg,"['6ea6bca4-4712-4ab9-a906-e3336a9d8039', '67259b26-ff83-444e-9d3c-faab390df16f', '6606e54c-f92d-40f6-8257-74977889ccdd', '8bbdb07d-df18-4f82-a928-04a9003e9a7e', 'd4461e94-570b-4973-b6a1-3afe026c12ca']",partner,"Play Smarter, Not harder. I am a full time variety streamer making tutorials and guides for mobile, anime, and strategy games.I teach people how to be better streamers.",
40491168590,94300771,Andvari11,513181,Genshin Impact,live,Starting my stream on Genshin Daily Grinds :) #Genshinimpact #genshingrind,35,2020-11-15T01:42:47Z,tl,https://static-cdn.jtvnw.net/previews-ttv/live_user_andvari11-{width}x{height}.jpg,['91d21edf-9d63-4ac8-9508-5448c3daf3f0'],affiliate,"Hey guys! Ian here! newbie on the streaming world! Love playing video games on my down time. Mostly playing Dota 2 but also a big fan of RPG, MMO types of games. Please feel free to say hi and don't forget to follow when i'm live streaming. Hoping to build a friendly community on this channel.",
40492476142,132444231,Melonsicle,513181,Genshin Impact,live,AR 42 | Ningguang C1 Main ~ Geos done! time for quests....,33,2020-11-15T02:50:53Z,en,https://static-cdn.jtvnw.net/previews-ttv/live_user_melonsicle-{width}x{height}.jpg,['6ea6bca4-4712-4ab9-a906-e3336a9d8039'],affiliate,Welcome to the Icebox!! Follow me on this journey from being a casual gamer to an avid gamer. I'm a variety streamer who loves to learn new games! Please join me in chat!! I want to hear from you!,
39993713020,68145728,Sereja_GL1n,513181,Genshin Impact,live,AR 46 | Собираю ВСЕ сундуки в Ли Юэ | Потом второй аккаунт,33,2020-11-15T04:54:57Z,ru,https://static-cdn.jtvnw.net/previews-ttv/live_user_sereja_gl1n-{width}x{height}.jpg,"['0569b171-2a2b-476e-a596-5bdfb45a1327', 'd35073b8-0e52-4375-9f75-3dde0c567911', 'df262ff6-74d1-415b-942c-d584d44426c4', 'ef4f33d5-a6cb-4935-bc1d-97c818a1e39e', '67259b26-ff83-444e-9d3c-faab390df16f']",affiliate,"Зовут Сергей, живу в РБ, город Пинск. 20 лет. Спасибо что смотрите",
40493564030,556267798,suheso,513181,Genshin Impact,live,do you ever just kachow your way into drinking ? | !discord ,31,2020-11-15T03:47:51Z,en,https://static-cdn.jtvnw.net/previews-ttv/live_user_suheso-{width}x{height}.jpg,"['6ea6bca4-4712-4ab9-a906-e3336a9d8039', '67259b26-ff83-444e-9d3c-faab390df16f', 'cc8d5abb-39c9-4942-a1ee-e1558512119e', '292d76d1-b0a2-4175-a313-fdb2c970cd69']",affiliate,SUHESO streams Minecraft and Genshin Impact ,
39717709597,22420167,Hotsammysliz,513181,Genshin Impact,live,[AR39] Genshin Gamin & Dollar Droppin | !uid !rise,30,2020-11-15T02:00:40Z,en,https://static-cdn.jtvnw.net/previews-ttv/live_user_hotsammysliz-{width}x{height}.jpg,['6ea6bca4-4712-4ab9-a906-e3336a9d8039'],partner,I play monster hunter and like memes.,
40495342782,408833795,wintermelyn,513181,Genshin Impact,live,testing part 87 - genpact imshin,30,2020-11-15T05:27:35Z,en,https://static-cdn.jtvnw.net/previews-ttv/live_user_wintermelyn-{width}x{height}.jpg,"['6ea6bca4-4712-4ab9-a906-e3336a9d8039', '3ffbec21-97a2-43f9-bd73-4506a1b4d62c', 'ab45fcb7-a22d-4a07-b0ac-fb3940566fa7', 'ff56eeeb-99ed-4a60-93fc-0b3f05d8661e', 'ac763b17-7bea-4632-9eb4-d106689ff409']",affiliate,I hope you smile.,
39716312621,80043748,Morenaw,513181,Genshin Impact,live,Sabadão com a Mo :) | !prime !sub !bits,30,2020-11-14T23:15:21Z,pt,https://static-cdn.jtvnw.net/previews-ttv/live_user_morenaw-{width}x{height}.jpg,"['39ee8140-901a-4762-bfca-8260dea1310f', '8a01ea18-df97-4046-9cff-a9a822bb96e5']",affiliate,"Olá! Sou a Morena, aqui você irá encontrar gameplays de: FPS, Retro, Battle Royale e muita variedade! Prezo um bom bate-papo com o chat, então sinta-se a vontade para conversar e fazer parte de nossa comunidade!",
40493130302,77172757,cktchaotic,513181,Genshin Impact,live,Restart Game! Let's Level Up,29,2020-11-15T03:24:34Z,en,https://static-cdn.jtvnw.net/previews-ttv/live_user_cktchaotic-{width}x{height}.jpg,['6ea6bca4-4712-4ab9-a906-e3336a9d8039'],affiliate,"My name is CKTCHAOTIC. People call me Crispy —don’t ask. I am a variety streamer. I unbox pokemon cards & collector toys, webtoon VA, and I play League of Rage (legend). I genuinely hate scary games. Check out the Channel Point Redemptions. 😉",
40493330958,90065036,CERES_CACERES,513181,Genshin Impact,live,[VTUBER | VSTREAMER] [PC] Back To Hunting Waifus!,29,2020-11-15T03:35:10Z,en,https://static-cdn.jtvnw.net/previews-ttv/live_user_ceres_caceres-{width}x{height}.jpg,"['6ea6bca4-4712-4ab9-a906-e3336a9d8039', '69318d09-f132-4853-b4b6-09a0580f7092', 'cc8d5abb-39c9-4942-a1ee-e1558512119e', 'eaba0ad7-c4e1-4878-b37f-01308dbb65c8']",affiliate,"Hey guys! I'm Ceres Cáceres, A maido hobbit who is really terrible at gaming.　こんにちは！セレス・ガデレスと申します！よろしくお願いします！",
39991429708,436405799,RealZureeal,513181,Genshin Impact,live,WAIFU TIME! GENSHIN,28,2020-11-14T21:44:38Z,en,https://static-cdn.jtvnw.net/previews-ttv/live_user_realzureeal-{width}x{height}.jpg,"['6ea6bca4-4712-4ab9-a906-e3336a9d8039', 'cc8d5abb-39c9-4942-a1ee-e1558512119e']",affiliate,HK Chinese+British!   |   “Egirl” just vibing!   |   ☆PuriPuri Squad!☆,
40490355342,566850090,ariarinchan,513181,Genshin Impact,live,VTuber || anime thighs yum,28,2020-11-15T00:59:34Z,en,https://static-cdn.jtvnw.net/previews-ttv/live_user_ariarinchan-{width}x{height}.jpg,"['6ea6bca4-4712-4ab9-a906-e3336a9d8039', '67259b26-ff83-444e-9d3c-faab390df16f', '6606e54c-f92d-40f6-8257-74977889ccdd', 'cc8d5abb-39c9-4942-a1ee-e1558512119e', '8bbdb07d-df18-4f82-a928-04a9003e9a7e', '353ab6ac-a0ee-404e-9bfa-217446b97718']",affiliate,"I'm Aria, the mecha pilot VStreamer who used to have the most unstable internet. Join me as I lose my mind over anime thighs and games.",
40495003022,174940773,LeahLuck_,513181,Genshin Impact,live, Diona is so uwu:) - Genshin Impact  / Stream Raiders... maybe PVP. lol -,27,2020-11-15T05:06:42Z,en,https://static-cdn.jtvnw.net/previews-ttv/live_user_leahluck_-{width}x{height}.jpg,['6ea6bca4-4712-4ab9-a906-e3336a9d8039'],affiliate,,
40491605086,60203137,MysticUmbreon,513181,Genshin Impact,live,The Legend of Weebs Breath of the Waifu,27,2020-11-15T02:04:50Z,en,https://static-cdn.jtvnw.net/previews-ttv/live_user_mysticumbreon-{width}x{height}.jpg,['6ea6bca4-4712-4ab9-a906-e3336a9d8039'],partner,Hey guys I am MysticUmbreon :) I do a lot of Pokemon related things on my youtube channel and I stream on twitch from time to time so if you like Pokemon Check out my channel. I also play a lot of Pokemon Games on here! My channel is:https://www.youtube.com/user/UmbreonMystic94,
