id,user_id,user_name,game_id,game_name,type,title,viewer_count,started_at,language,thumbnail_url,tag_ids,broadcaster_type,description,type
40490267742,87414811,courtiebee,488190,Poker,live,"⏩ $100 Spins, FT $109 Bounty Hunter ⏪",417,2020-11-15T00:54:57Z,en,https://static-cdn.jtvnw.net/previews-ttv/live_user_courtiebee-{width}x{height}.jpg,"['6ea6bca4-4712-4ab9-a906-e3336a9d8039', '59389904-284b-4479-9d7d-e519d8fa8fb0']",partner,"If you're new to my channel, check out my video uploads for past broadcasts!",
40468603198,225772624,runitup247,488190,Poker,live,24/7 Poker Content Brought to You by Run It Up and PokerStars,400,2020-11-13T19:24:56Z,en,https://static-cdn.jtvnw.net/previews-ttv/live_user_runitup247-{width}x{height}.jpg,['6ea6bca4-4712-4ab9-a906-e3336a9d8039'],partner,Nonstop poker action brought to you by Run It Up and PokerStars!,
40489589678,81719326,EbonyKenney,488190,Poker,live,SATURDAY MTTs & CHILL || !thebigdeal !giveaway !flips !acr !lpp !therake,173,2020-11-15T00:14:51Z,en,https://static-cdn.jtvnw.net/previews-ttv/live_user_ebonykenney-{width}x{height}.jpg,['6ea6bca4-4712-4ab9-a906-e3336a9d8039'],affiliate,"Professional Poker Player, Streamer, & Confidence Coach.  Outspoken and no BS, consider this your new home for positivity, inclusivity, and a boost of chill vibes whenever you need them. ",
40493591518,67778852,PURPLEPILS99,488190,Poker,live,Midstakes PLO on N8!--> !wix ,151,2020-11-15T03:49:21Z,en,https://static-cdn.jtvnw.net/previews-ttv/live_user_purplepils99-{width}x{height}.jpg,['6ea6bca4-4712-4ab9-a906-e3336a9d8039'],partner,"Poker Pro, Mindset Coach, Meditation Coach,Father - Improve at Poker and Eliminate your tilt!.Come join in the fun Every day at 8pm Pacific time and starting at 10am Sundays for tournament/PLO mix! Non Profit, All money made from twitch gets matched by me and donated to charity #BecomeTiltproof",
39990108220,59337017,Wolfkind7,488190,Poker,live,"NL50 Grind | Overtime , havent slept yet KEKW",137,2020-11-14T20:24:05Z,en,https://static-cdn.jtvnw.net/previews-ttv/live_user_wolfkind7-{width}x{height}.jpg,['6ea6bca4-4712-4ab9-a906-e3336a9d8039'],affiliate,"My name is Dustin Damianov aka ""Wolfkind7"" on Twitch, but most people just call me Wolf. I am 26 years old and from Germany. I have been passionate about poker for multiple years now and have been grinding it out on the microstakes cashgame streets sofar.",
39717856637,137187417,ShipDontDie,488190,Poker,live,"Final 2 Tables 40k gtd ~ $6,888 to 1st",117,2020-11-15T02:16:42Z,en,https://static-cdn.jtvnw.net/previews-ttv/live_user_shipdontdie-{width}x{height}.jpg,"['6ea6bca4-4712-4ab9-a906-e3336a9d8039', '1eba3cfe-51cc-460a-8259-bc8bb987f904', 'b638f288-a35b-4b46-921e-54f59612a844', '59389904-284b-4479-9d7d-e519d8fa8fb0', '692af1d4-da0f-4b9b-889b-2579adc53765', 'b13ce7d5-d513-49ff-a957-76f193df42aa']",affiliate,"My name's Chris. Im 34 from the USA. I've been playing poker professionally since January of 2017.  I play mainly no limit holdem multi table tournaments. Streaming really helps with the monotony of the poker grind. I love listening to good tunes, winning big $$$, and hanging with the degens!",
39708577533,85188856,WorldPokerTour,488190,Poker,live,WPT Action!,74,2020-11-13T22:50:17Z,en,https://static-cdn.jtvnw.net/previews-ttv/live_user_worldpokertour-{width}x{height}.jpg,"['6ea6bca4-4712-4ab9-a906-e3336a9d8039', '59389904-284b-4479-9d7d-e519d8fa8fb0', 'b638f288-a35b-4b46-921e-54f59612a844', '423f9bc1-5b64-4355-8dfe-4d7466455ba2', 'bb5e7234-380e-48ad-a59c-03e51274e478', 'a005b174-b20e-46b1-8679-4589fef81c8e']",partner,"World Poker Tour ignited the global poker boom with a unique television show based on a series of high-stakes tournaments. WPT events turned Gus Hansen into the Great Dane and Daniel Negreanu into Kid Poker, and created dozens of poker-made millionaires.",
39715269277,428637684,p_rozay,488190,Poker,live,"$2131 UP TOP.. ITM $11 - $15,000 GTD w/PreEminent_Ez ~~  !MOSS !acr !epc",63,2020-11-14T20:52:16Z,en,https://static-cdn.jtvnw.net/previews-ttv/live_user_p_rozay-{width}x{height}.jpg,['6ea6bca4-4712-4ab9-a906-e3336a9d8039'],affiliate,"Hey everyone!  Welcome to the P_Rozay show!  I'm a full time poker player from Cleveland, Ohio!  I've been playing poker on and off for 10 years now, and decided in December to take the leap into full-time pro.  Feel free to join the fun!  OH!",
39993695004,595236668,vituss__brttva,488190,Poker,live,Витус в JoyCasino! Онлайн Казино,60,2020-11-15T04:39:42Z,ru,https://static-cdn.jtvnw.net/previews-ttv/live_user_vituss__brttva-{width}x{height}.jpg,['0569b171-2a2b-476e-a596-5bdfb45a1327'],,,
40493162654,83437834,dmakk767,488190,Poker,live,pokerz- day 78 🏆🏆🏆 !sr 🔴Live from thaBasement™,35,2020-11-15T03:26:17Z,en,https://static-cdn.jtvnw.net/previews-ttv/live_user_dmakk767-{width}x{height}.jpg,"['6ea6bca4-4712-4ab9-a906-e3336a9d8039', '59389904-284b-4479-9d7d-e519d8fa8fb0', '423f9bc1-5b64-4355-8dfe-4d7466455ba2', '59468cdb-d497-4d39-b423-4882f184b357', '9801169b-afa4-4785-890e-53911955e4d7', 'e659959d-392f-44c5-83a5-fb959cdbaccc']",affiliate,Long time online grinder making his way from thaBasement™ to thaYellowBrickRoad™. Come join us on our way to the top!,
39986772780,415819785,partypoker247,488190,Poker,live,partypoker live - archived content brought to you by partypoker247!,35,2020-11-14T17:18:32Z,en,https://static-cdn.jtvnw.net/previews-ttv/live_user_partypoker247-{width}x{height}.jpg,['6ea6bca4-4712-4ab9-a906-e3336a9d8039'],,The official partypoker 24/7 Twitch channel. Content is intended solely for those over the age of 18.,
39992931996,83088120,MarcGork,488190,Poker,live,Rush&Cash Leaderboard auf GG angreifen - Testlauf in der Nacht // Neues Setup steht! !pc // !fb !insta !dc,30,2020-11-15T00:06:59Z,de,https://static-cdn.jtvnw.net/previews-ttv/live_user_marcgork-{width}x{height}.jpg,"['9166ad14-41f1-4b04-a3b8-c8eb838c6be6', '423f9bc1-5b64-4355-8dfe-4d7466455ba2', '59468cdb-d497-4d39-b423-4882f184b357']",affiliate,"Marc Gork (*1987)// Pokerspieler, bekannt aus EPT und German High Roller// Chiplead Host// Streamer auf Twitch seit Mai 2020",
40492906622,108297540,pokergal13,488190,Poker,live,Giveaways! Plus TWITCH STORM! Bankroll challenge! <3 !challenge !discord !br ACR Action! <3 Come pop in an say hello :),29,2020-11-15T03:12:39Z,en,https://static-cdn.jtvnw.net/previews-ttv/live_user_pokergal13-{width}x{height}.jpg,"['6ea6bca4-4712-4ab9-a906-e3336a9d8039', '59389904-284b-4479-9d7d-e519d8fa8fb0', '423f9bc1-5b64-4355-8dfe-4d7466455ba2', 'b638f288-a35b-4b46-921e-54f59612a844', 'ff56eeeb-99ed-4a60-93fc-0b3f05d8661e', '692af1d4-da0f-4b9b-889b-2579adc53765']",affiliate,"Welcome to the DO BETTER TEAM. Where, everyday we strive to do better and be better. In poker and in life! See you at the tables!!",
40489433390,137579424,MadMaxwell82,488190,Poker,live,How good is your poker face. let's see. !what,23,2020-11-15T00:05:23Z,en,https://static-cdn.jtvnw.net/previews-ttv/live_user_madmaxwell82-{width}x{height}.jpg,['6ea6bca4-4712-4ab9-a906-e3336a9d8039'],affiliate,"I am a Gamer at heart, love grinding and helping people. I am constantly learning and I hope that you can hang out and learn with me.",
39993713820,41568369,Alternative1212,488190,Poker,live,"PLO25 сессия+постараюсь не флеймить, но не обещаю.",18,2020-11-15T04:55:37Z,ru,https://static-cdn.jtvnw.net/previews-ttv/live_user_alternative1212-{width}x{height}.jpg,['0569b171-2a2b-476e-a596-5bdfb45a1327'],affiliate,,
40493409966,541608592,HustlePoker,488190,Poker,live,5NL Zoom ,18,2020-11-15T03:39:30Z,en,https://static-cdn.jtvnw.net/previews-ttv/live_user_hustlepoker-{width}x{height}.jpg,['6ea6bca4-4712-4ab9-a906-e3336a9d8039'],affiliate,"Former small stakes professional from Vancouverish, BC coming back to the world of online poker as a rec fish to fool around in the micros.",
39718061517,121641768,rodloiola,488190,Poker,live,KING FIVE CARS TEAM!!!! OMAHA 5 CARDS  2/4 ,17,2020-11-15T02:39:39Z,pt,https://static-cdn.jtvnw.net/previews-ttv/live_user_rodloiola-{width}x{height}.jpg,['39ee8140-901a-4762-bfca-8260dea1310f'],affiliate,,
40494579086,226441204,FantasticFallon,488190,Poker,live,ITM BOL 30k 5k for 1st!!!,15,2020-11-15T04:42:34Z,en,https://static-cdn.jtvnw.net/previews-ttv/live_user_fantasticfallon-{width}x{height}.jpg,['6ea6bca4-4712-4ab9-a906-e3336a9d8039'],affiliate,I play poker for a living and stream the journey. I play the guitar and sing a little too. If you have any questions just ask :),
39993644540,403374623,Team_Vioks,488190,Poker,live,Sunday Poker Session Tbi,15,2020-11-15T04:02:06Z,fr,https://static-cdn.jtvnw.net/previews-ttv/live_user_team_vioks-{width}x{height}.jpg,"['6f655045-9989-4ef7-8f85-1edcec42d648', '653ad792-5ec6-4bd9-aeb6-8a70b32f1ee4']",affiliate,"Tu cherches le meilleur stream du Twitch game ?  c'est ici !!  :)  3 Vioks qui  proposent   + de 200 heures de stream / mois ! + de 2150 followers ,  une communauté  de + de 300 membres sur Discord , + de 150 membres sur le groupe Facebook ",
40493790654,117850708,TheImpromptu,488190,Poker,live,The Impromptu ,14,2020-11-15T04:00:06Z,en,https://static-cdn.jtvnw.net/previews-ttv/live_user_theimpromptu-{width}x{height}.jpg,['6ea6bca4-4712-4ab9-a906-e3336a9d8039'],,"The Impromptu has run continuously for over ten years and 550 games. We play to win, but we're playing for fun, and the coveted Impromptu Cup!",
39993677516,103484386,SotoSensei,488190,Poker,live,12H STREAM  |  Happy birthday Soto!,13,2020-11-15T04:25:41Z,es,https://static-cdn.jtvnw.net/previews-ttv/live_user_sotosensei-{width}x{height}.jpg,['d4bb9c58-2141-4881-bcdc-3fe0505457d1'],affiliate,"Hey, I'm Soto!I like to play every kind of game and I stream them both in English and Spanish! Buenas, soy soto! Juego todo tipo de juegos y me aseguro de stremearlos en Inglés y en Español!",
39987835132,280356382,PokerStaples247,488190,Poker,live,24/7 PokerStaples Stream Highlights!,11,2020-11-14T18:20:55Z,en,https://static-cdn.jtvnw.net/previews-ttv/live_user_pokerstaples247-{width}x{height}.jpg,['6ea6bca4-4712-4ab9-a906-e3336a9d8039'],,,
39718405005,161214272,maC4ShOw,488190,Poker,live,Big 3.3 - 18 left  !stepteam !delay3min,10,2020-11-15T03:20:43Z,pt,https://static-cdn.jtvnw.net/previews-ttv/live_user_mac4show-{width}x{height}.jpg,['39ee8140-901a-4762-bfca-8260dea1310f'],affiliate,"Me chamo Jefferson Alcantara França, tenho 25 anos, sou casado a 5 anos e tenho um sonho de jogar poker profissional, atualmente sou jogador de MICRO pelo STEP TEAM e penso em crescer cada vez mais.",
39993454636,103825905,1Prodigy11,488190,Poker,live,Saturday night poker lets go🔥,9,2020-11-15T02:14:13Z,en,https://static-cdn.jtvnw.net/previews-ttv/live_user_1prodigy11-{width}x{height}.jpg,['6ea6bca4-4712-4ab9-a906-e3336a9d8039'],,Aspiring poker player very social come enjoy good vibes and poker,
39991329356,84915810,DramaGaming07,488190,Poker,live,premier live poker - hésitez pas a me donner des conseils si vous en avez   ( Fr PS4 HD 2020 ),9,2020-11-14T21:37:56Z,fr,https://static-cdn.jtvnw.net/previews-ttv/live_user_dramagaming07-{width}x{height}.jpg,"['6f655045-9989-4ef7-8f85-1edcec42d648', '423f9bc1-5b64-4355-8dfe-4d7466455ba2']",," Salut jeune padawan , ici je stream surtout du Carx Drift/ the Hunter/ fishing planet/ F1/// Je suis Artiste Peintre et Musicien, retrouvez moi sur Youtube: Dramastiik / Instagram perso et FB perso: Dramastiik / Snapchat: Dramastiik / FB pro: Drama Design Hydrography / FB musique: Drama Music",
40494937294,508753055,CavinCasino,488190,Poker,live,Nick B makes a run at the $2K ShopWPT Lynn Gilmartin Bounty Tournamnet,8,2020-11-15T05:02:53Z,en,https://static-cdn.jtvnw.net/previews-ttv/live_user_cavincasino-{width}x{height}.jpg,"['6ea6bca4-4712-4ab9-a906-e3336a9d8039', '692af1d4-da0f-4b9b-889b-2579adc53765', '423f9bc1-5b64-4355-8dfe-4d7466455ba2', 'b13ce7d5-d513-49ff-a957-76f193df42aa']",affiliate,"Gaming Consultant and Managing Member of Gaming Advancement Marketing Entertainment, G.A.M.E., LLC, Tournament Manager at the Gardens Casino, Los Angeles, CA USA and Ambassador to all things that are Good for the GAME. Poker, Table Games, NFL, NBA, MLB, eSports, Fantasy Football & more.",
40494924142,135779503,roedawg009,488190,Poker,live,ACR Final Table Hunting. $306 Up Top. Giveaway on Final Table,8,2020-11-15T05:02:10Z,en,https://static-cdn.jtvnw.net/previews-ttv/live_user_roedawg009-{width}x{height}.jpg,['6ea6bca4-4712-4ab9-a906-e3336a9d8039'],affiliate,Going through channel renovations. Stick around for new developments. #DAWGPOUND #DAWGNATION,
40494881326,184658638,xDayRan,488190,Poker,live,Saturday Night Tournament. Punted Chips already so im out.,6,2020-11-15T04:59:56Z,en,https://static-cdn.jtvnw.net/previews-ttv/live_user_xdayran-{width}x{height}.jpg,['6ea6bca4-4712-4ab9-a906-e3336a9d8039'],affiliate,I show flashes of greatness 22.39% of the time. Hang out and you might get a glimpse.,
40494283214,438641947,danidndani,488190,Poker,live,EPT епта,6,2020-11-15T04:26:17Z,ru,https://static-cdn.jtvnw.net/previews-ttv/live_user_danidndani-{width}x{height}.jpg,['0569b171-2a2b-476e-a596-5bdfb45a1327'],affiliate,"ПРИВЕТ ЗРИТЕЛЬ ! Меня зовут Денис/33/Хабаровск/в теме 12 лет/MTT-PLO,NLHE,spin&go- ХОЧЕШЬ ИГРАТЬ СО МНОЙ В КОЛЕСЕ ФОРТУНЫ????? ПРАВИЛА В ОПИСАНИИ КАНАЛА !!!",
39993532636,100378590,glazirovannyi_smychok,488190,Poker,live, Марафон omaha8 по следам марафонца,6,2020-11-15T02:51:01Z,ru,https://static-cdn.jtvnw.net/previews-ttv/live_user_glazirovannyi_smychok-{width}x{height}.jpg,['0569b171-2a2b-476e-a596-5bdfb45a1327'],,,
40495225246,274856258,MagnusGaming89,488190,Poker,live,PartyPoker - Final Table - CHIP LEADER,5,2020-11-15T05:20:10Z,en,https://static-cdn.jtvnw.net/previews-ttv/live_user_magnusgaming89-{width}x{height}.jpg,"['6ea6bca4-4712-4ab9-a906-e3336a9d8039', 'ef4f33d5-a6cb-4935-bc1d-97c818a1e39e', '1eba3cfe-51cc-460a-8259-bc8bb987f904', '69318d09-f132-4853-b4b6-09a0580f7092']",,I'm an aspiring Poker Pro  looking to constantly improve my game.,
40488617198,146609268,OldWisco,488190,Poker,live,We Enjoy It,5,2020-11-14T23:11:56Z,en,https://static-cdn.jtvnw.net/previews-ttv/live_user_oldwisco-{width}x{height}.jpg,['6ea6bca4-4712-4ab9-a906-e3336a9d8039'],affiliate,Low stakes card player mostly streaming deep runs for friends and study partners. Always looking for people to study with. ,
39718573373,88740624,WOWMUSTBENICE,488190,Poker,live,Pokerstars PA: WOWMUSTBENICE running SATURDAY NIGHT MTTs LFG,4,2020-11-15T03:42:47Z,en,https://static-cdn.jtvnw.net/previews-ttv/live_user_wowmustbenice-{width}x{height}.jpg,"['6ea6bca4-4712-4ab9-a906-e3336a9d8039', '692af1d4-da0f-4b9b-889b-2579adc53765', '423f9bc1-5b64-4355-8dfe-4d7466455ba2', 'b13ce7d5-d513-49ff-a957-76f193df42aa']",,"I have been playing poker since 2004. In 2011 on the epic 'Black Friday' , dreams were shattered with the shutdown of online poker. Now with the regulation of online poker in Pennsylvania, I'm back baby!!! My specialty is heads up sit and goes, where I currently rank 5th in profit on Pokerstars PA. ",
40491137422,184819744,Ig0tdibs,488190,Poker,live,Saturday poker fun,3,2020-11-15T01:41:04Z,en,https://static-cdn.jtvnw.net/previews-ttv/live_user_ig0tdibs-{width}x{height}.jpg,['6ea6bca4-4712-4ab9-a906-e3336a9d8039'],,Playing poker for you guys to enjoy,
40487534926,63369750,ntimidatr,488190,Poker,live,stop and say hi! giveaways and 50/50 stakes,3,2020-11-14T21:55:28Z,en,https://static-cdn.jtvnw.net/previews-ttv/live_user_ntimidatr-{width}x{height}.jpg,['6ea6bca4-4712-4ab9-a906-e3336a9d8039'],affiliate,Stop by and say hi! Stay for the good music!,
40490399166,179403203,BennyTheJet,488190,Poker,live,"$100 -> $1K BR Challenge, come say hey!",3,2020-11-15T01:01:27Z,en,https://static-cdn.jtvnw.net/previews-ttv/live_user_bennythejet-{width}x{height}.jpg,['6ea6bca4-4712-4ab9-a906-e3336a9d8039'],,,
39993492796,530684027,wimmbOS,488190,Poker,live,челлендж со 130 до 1000$ день 5 :),2,2020-11-15T02:30:53Z,ru,https://static-cdn.jtvnw.net/previews-ttv/live_user_wimmbos-{width}x{height}.jpg,['0569b171-2a2b-476e-a596-5bdfb45a1327'],,,
39718686109,195642421,ren0ave,488190,Poker,live,AMERICAS CARD ROOM TOURNAMENTS ,2,2020-11-15T03:58:08Z,en,https://static-cdn.jtvnw.net/previews-ttv/live_user_ren0ave-{width}x{height}.jpg,['6ea6bca4-4712-4ab9-a906-e3336a9d8039'],,ACR POKER 24/7 👉REN0AVE👈 ♦️♠️♦️Instagram👉 Ren0ave,
40487181054,160550691,Grindin427,488190,Poker,live,Final Table $2k Gtd. ,2,2020-11-14T21:27:52Z,en,https://static-cdn.jtvnw.net/previews-ttv/live_user_grindin427-{width}x{height}.jpg,['6ea6bca4-4712-4ab9-a906-e3336a9d8039'],affiliate,,
39719144749,104946671,waitt93,488190,Poker,live,Rush & cash N8,2,2020-11-15T05:15:45Z,es,https://static-cdn.jtvnw.net/previews-ttv/live_user_waitt93-{width}x{height}.jpg,['d4bb9c58-2141-4881-bcdc-3fe0505457d1'],,Streaming de Poker online ♣ ♠ ♦ ♥,
40494766654,476194675,1vandzhannn,488190,Poker,live,Будем разбиратся),2,2020-11-15T04:53:25Z,ru,https://static-cdn.jtvnw.net/previews-ttv/live_user_1vandzhannn-{width}x{height}.jpg,"['0569b171-2a2b-476e-a596-5bdfb45a1327', 'eeea68da-c4b8-4268-b17a-eb0f30286843', 'fd8f5e68-42d3-4544-a273-5fc92dabc568']",,"В основном тут игры на деньги , обычные или просто джуст чатинг , развлечение и трэш.",
40493812526,449899905,CoachBaileyCooper,488190,Poker,live,!swc !acr $6k gtd $10k gtd LFG!,2,2020-11-15T04:01:06Z,en,https://static-cdn.jtvnw.net/previews-ttv/live_user_coachbaileycooper-{width}x{height}.jpg,"['6ea6bca4-4712-4ab9-a906-e3336a9d8039', '692af1d4-da0f-4b9b-889b-2579adc53765']",,"On this stream, we play micro-mid stakes cash/mtt NL Hold-em, Among-Us, Roblox, CoD, And have an all around good time. I wanted to create a community that thrives on helping each other get better at life!",
40493912142,89260573,608_twitcher,488190,Poker,live,Nightly Grind!$,1,2020-11-15T04:06:12Z,en,https://static-cdn.jtvnw.net/previews-ttv/live_user_608_twitcher-{width}x{height}.jpg,['6ea6bca4-4712-4ab9-a906-e3336a9d8039'],,,
40494294094,448987076,GypsyStonePoker,488190,Poker,live,ACR $2000 GTD,1,2020-11-15T04:26:51Z,en,https://static-cdn.jtvnw.net/previews-ttv/live_user_gypsystonepoker-{width}x{height}.jpg,['6ea6bca4-4712-4ab9-a906-e3336a9d8039'],,,
39993733340,416418643,pwnezTV,488190,Poker,live,[18+][GER/ENG] 9-Max Turbo Sit & Go Micros | Chess Amateur Elo Grind Soon,1,2020-11-15T05:11:43Z,de,https://static-cdn.jtvnw.net/previews-ttv/live_user_pwneztv-{width}x{height}.jpg,"['9166ad14-41f1-4b04-a3b8-c8eb838c6be6', 'e659959d-392f-44c5-83a5-fb959cdbaccc', 'cea7bc0c-75a5-4446-8743-6db031b71550', 'ffc2deb9-cdac-4d5a-8554-381f165805ca', 'b638f288-a35b-4b46-921e-54f59612a844', 'ea731a85-fd78-4cce-ab94-c71b2d0f9fc7']",affiliate,"Underground Exclusive: GAMER CLICKING BUTTONS - More info click ""About"" tab",
39993644524,426820682,Tbi704,488190,Poker,live,Faire sa bankroll  TEXAS HOLDEM  Pokerstars fr tbi704,1,2020-11-15T04:02:04Z,fr,https://static-cdn.jtvnw.net/previews-ttv/live_user_tbi704-{width}x{height}.jpg,['6f655045-9989-4ef7-8f85-1edcec42d648'],affiliate,"Vieux grincheux solitaire, de 60 ans, passe sa retraite a jouer au poker. Arrive du pays Basque (Biarritz) après de long périple dans le sud de l’Espagne ou le soleil a la couleur or, j essai de gravir les marches du ranking, dieux que c est dure a cet age.....",
39967918380,472806106,ebingoruleta,488190,Poker,live,ruleta,1,2020-11-13T08:33:30Z,es,https://static-cdn.jtvnw.net/previews-ttv/live_user_ebingoruleta-{width}x{height}.jpg,['d4bb9c58-2141-4881-bcdc-3fe0505457d1'],,,
39715924333,139151934,wptlive,488190,Poker,live,WPT Action!,1,2020-11-14T22:24:18Z,pt,https://static-cdn.jtvnw.net/previews-ttv/live_user_wptlive-{width}x{height}.jpg,['39ee8140-901a-4762-bfca-8260dea1310f'],partner,"World Poker Tour ignited the global poker boom with a unique television show based on a series of high-stakes tournaments. WPT events turned Gus Hansen into the Great Dane and Daniel Negreanu into Kid Poker, and created dozens of poker-made millionaires. ",
39993749708,608726222,OmahaMaximum,488190,Poker,live,OmaHA  PLO 2 ,1,2020-11-15T05:26:31Z,ru,https://static-cdn.jtvnw.net/previews-ttv/live_user_omahamaximum-{width}x{height}.jpg,['0569b171-2a2b-476e-a596-5bdfb45a1327'],,"Проходим ОМАХу. Цель стрима начать омаху с 0, пройти первый лимит + постараться не тильтовать, играю максимум 6 столов , пробуем подняться по лимитам? задержка 1 мин",
40488431406,138083594,local_goon,488190,Poker,live,MTT time we always bink,1,2020-11-14T22:59:43Z,en,https://static-cdn.jtvnw.net/previews-ttv/live_user_local_goon-{width}x{height}.jpg,"['6ea6bca4-4712-4ab9-a906-e3336a9d8039', 'b638f288-a35b-4b46-921e-54f59612a844', '692af1d4-da0f-4b9b-889b-2579adc53765']",,,
39993745180,112519853,ryudzomacuda,488190,Poker,live,из дна в Бийск ) ,1,2020-11-15T05:22:07Z,ru,https://static-cdn.jtvnw.net/previews-ttv/live_user_ryudzomacuda-{width}x{height}.jpg,['0569b171-2a2b-476e-a596-5bdfb45a1327'],,,
40494536654,63769013,imwanton,488190,Poker,live,Chillin n Drinkin,1,2020-11-15T04:40:08Z,en,https://static-cdn.jtvnw.net/previews-ttv/live_user_imwanton-{width}x{height}.jpg,['6ea6bca4-4712-4ab9-a906-e3336a9d8039'],,Here to have some fun ,
40495224798,81991967,Mosie,488190,Poker,live,$0.25 / $0.50 No Limit Hold'em 24h Session 1st Attempt,1,2020-11-15T05:20:08Z,en,https://static-cdn.jtvnw.net/previews-ttv/live_user_mosie-{width}x{height}.jpg,['6ea6bca4-4712-4ab9-a906-e3336a9d8039'],affiliate,"Follow me, it's alright where I'm going. :)Join me in the #CalendarClub",
40470518430,183299420,BlockchainPoker,488190,Poker,live,Blockchain Poker - Play with Bitcoin for Free!,1,2020-11-13T22:08:37Z,en,https://static-cdn.jtvnw.net/previews-ttv/live_user_blockchainpoker-{width}x{height}.jpg,['6ea6bca4-4712-4ab9-a906-e3336a9d8039'],,https://blockchain.poker,
40493210814,36184520,HackShardGaming,488190,Poker,live,World of Warcraft | Illidan | Horde | <Mind Games> | Scourge Rares | Poker while waiting!,1,2020-11-15T03:28:57Z,en,https://static-cdn.jtvnw.net/previews-ttv/live_user_hackshardgaming-{width}x{height}.jpg,['6ea6bca4-4712-4ab9-a906-e3336a9d8039'],,,
39715002477,411166945,jeffgrosspoker247,488190,Poker,live,24/7 JeffGrossPoker Deep runs stream highlights & Vlogs!,1,2020-11-14T20:11:48Z,en,https://static-cdn.jtvnw.net/previews-ttv/live_user_jeffgrosspoker247-{width}x{height}.jpg,['6ea6bca4-4712-4ab9-a906-e3336a9d8039'],affiliate,,
39990098604,183308100,KoofyMe,488190,Poker,live,"PokerScamm
",1,2020-11-14T20:23:34Z,en,https://static-cdn.jtvnw.net/previews-ttv/live_user_koofyme-{width}x{height}.jpg,"['6ea6bca4-4712-4ab9-a906-e3336a9d8039', '423f9bc1-5b64-4355-8dfe-4d7466455ba2', '59389904-284b-4479-9d7d-e519d8fa8fb0', 'b13ce7d5-d513-49ff-a957-76f193df42aa']",,,
39991844828,563579153,fedo_ot950,488190,Poker,live,"24 часа покер 12,68/13000$ day 1.ку в чай :).delay 75s",1,2020-11-14T22:13:12Z,ru,https://static-cdn.jtvnw.net/previews-ttv/live_user_fedo_ot950-{width}x{height}.jpg,['0569b171-2a2b-476e-a596-5bdfb45a1327'],,,
