id,user_id,user_name,game_id,game_name,type,title,viewer_count,started_at,language,thumbnail_url,tag_ids,broadcaster_type,description,type
40494656142,279425206,EsG_Henry,518204,FIFA 21,live,FUT CHAMPIONS CON LA PALMERA (12-0),26,2020-11-15T04:47:02Z,es,https://static-cdn.jtvnw.net/previews-ttv/live_user_esg_henry-{width}x{height}.jpg,['d4bb9c58-2141-4881-bcdc-3fe0505457d1'],affiliate,Jugador competitivo de FIFA para Essentials Gaming 🇲🇽 ,
40489386462,59607739,Jorgemsk15,518204,FIFA 21,live,[ENG/ESP] Pro Clubs Playing w/ Viewers D1 !Join !Youtube !Discord ,25,2020-11-15T00:02:41Z,en,https://static-cdn.jtvnw.net/previews-ttv/live_user_jorgemsk15-{width}x{height}.jpg,"['e90b5f6e-4c6e-4003-885b-4d0d5adeb580', 'ac763b17-7bea-4632-9eb4-d106689ff409', '6ea6bca4-4712-4ab9-a906-e3336a9d8039', '4ada413e-c7c4-4fc0-b3d6-ce4b98e0d5e3']",affiliate,"I'm a gamer, a musician, a nerd, and somehow people find that entertaining. ",
40493951742,178264886,chino_retro,518204,FIFA 21,live,TRADEO GANAMOS MUCHAS MONEDAS ,25,2020-11-15T04:08:18Z,es,https://static-cdn.jtvnw.net/previews-ttv/live_user_chino_retro-{width}x{height}.jpg,"['d4bb9c58-2141-4881-bcdc-3fe0505457d1', 'ac763b17-7bea-4632-9eb4-d106689ff409', '8ba227ca-073c-46a7-b3cc-193e52c5ab4d', 'ff56eeeb-99ed-4a60-93fc-0b3f05d8661e']",affiliate,"HACER GANAR MONEDAS ,CON METODOS DE TRADEO PARA FIFA ",
39717147181,89011073,EmbaixadorDoRage,518204,FIFA 21,live,WL DO AMOR SABADO DA MALDADE ,24,2020-11-15T00:57:53Z,pt,https://static-cdn.jtvnw.net/previews-ttv/live_user_embaixadordorage-{width}x{height}.jpg,['39ee8140-901a-4762-bfca-8260dea1310f'],affiliate,LIVES DIARIAS AQUI NA TWITCH..Doações nesse link.: https://streamelements.com/embaxadordorage/tip,
40492635950,178123973,Voncita20,518204,FIFA 21,live,PRO FUT CHAMPIONS (MAIN 8-0 / RTG 14-3) | 19 ESPORTS | FIFA PRO PLAYER - VERIFICADO |,22,2020-11-15T02:59:10Z,es,https://static-cdn.jtvnw.net/previews-ttv/live_user_voncita20-{width}x{height}.jpg,['d4bb9c58-2141-4881-bcdc-3fe0505457d1'],affiliate,"Jugador profesional de FIFA para 19esports / Costa Rica, 25 años  / Único Centroamericano finalista de FIFA eWorld Cup 16'/ Múltiple Campeón Nacional  / Subcampeón del mundo International Esports Festival 2019 (FIFA Online 4)",
39717513037,149652273,Rorito,518204,FIFA 21,live,[URU/ESP] !ig !discord !subgratis !creador | Sabelo con el sabaduti!! Como va?? | FIFA 21,22,2020-11-15T01:38:30Z,es,https://static-cdn.jtvnw.net/previews-ttv/live_user_rorito-{width}x{height}.jpg,"['d4bb9c58-2141-4881-bcdc-3fe0505457d1', 'ac763b17-7bea-4632-9eb4-d106689ff409', 'ff56eeeb-99ed-4a60-93fc-0b3f05d8661e', '67259b26-ff83-444e-9d3c-faab390df16f']",partner,"Uruguayo, 21 años, strimeo lo que pinte",
39993670348,484613295,CyberLiveArena,518204,FIFA 21,live,eFootball  FIFA21 CyberLive!Arena,22,2020-11-15T04:20:40Z,en,https://static-cdn.jtvnw.net/previews-ttv/live_user_cyberlivearena-{width}x{height}.jpg,"['6ea6bca4-4712-4ab9-a906-e3336a9d8039', '4ada413e-c7c4-4fc0-b3d6-ce4b98e0d5e3']",affiliate,https://linktr.ee/Cyber_live_arena,
39718768973,437078877,kevvi9_,518204,FIFA 21,live,FIFA21 차분한 발라드들으며 풋챔쓰~ 11W-1L,21,2020-11-15T04:10:00Z,ko,https://static-cdn.jtvnw.net/previews-ttv/live_user_kevvi9_-{width}x{height}.jpg,"['ab2975e3-b9ca-4b1a-a93e-fb61a5d5c3a4', '1eba3cfe-51cc-460a-8259-bc8bb987f904']",,Verified FIFA Player안녕하세요 피파21 엘리트유저 Kevvi9입니다.,
39716442493,266233911,aziz_gaming92,518204,FIFA 21,live,نلعب فوت تشامب بحسابين حياكم ,20,2020-11-14T23:32:25Z,ar,https://static-cdn.jtvnw.net/previews-ttv/live_user_aziz_gaming92-{width}x{height}.jpg,['73cc486a-e56b-41ed-a1df-7afedbc84f6f'],affiliate,حياكم الله حبايبي في قناتي اتمنى لاتحرمونا من الدعم والفلو ❤️,
40492405934,133005446,노숙문,518204,FIFA 21,live,PS5 ㅍㅍ,19,2020-11-15T02:47:12Z,ko,https://static-cdn.jtvnw.net/previews-ttv/live_user_nsm79-{width}x{height}.jpg,['ab2975e3-b9ca-4b1a-a93e-fb61a5d5c3a4'],affiliate,안녕하세요 피파머신 노숙문입니다~~,
39719053853,71641394,CAM7,518204,FIFA 21,live,EMPEZAMOS FUTCHAMPIONS / YA TENEMOS PARA MBAPPE ,19,2020-11-15T04:57:59Z,es,https://static-cdn.jtvnw.net/previews-ttv/live_user_cam7-{width}x{height}.jpg,['d4bb9c58-2141-4881-bcdc-3fe0505457d1'],partner,,
39715890637,162270485,zaphhTV,518204,FIFA 21,live,Cola com o Zaphão!,19,2020-11-14T22:19:33Z,pt,https://static-cdn.jtvnw.net/previews-ttv/live_user_zaphhtv-{width}x{height}.jpg,['39ee8140-901a-4762-bfca-8260dea1310f'],affiliate,"Salve galera! zaph é o maior patife do BR! Especialista em zews e faca, mas as vezes joga sério! Bora se divertir com o zaphão!",
39718938813,145591321,GuiFuchs_,518204,FIFA 21,live,[Pro] WL do disconnect + Resenha !!! ,19,2020-11-15T04:37:00Z,pt,https://static-cdn.jtvnw.net/previews-ttv/live_user_guifuchs_-{width}x{height}.jpg,['39ee8140-901a-4762-bfca-8260dea1310f'],affiliate,,
40493840558,126568970,ThatBoyAnto,518204,FIFA 21,live,(ENG) ROAD TO ELITE  / @ThatBoyAnto  / New Sub Goal!,19,2020-11-15T04:02:30Z,en,https://static-cdn.jtvnw.net/previews-ttv/live_user_thatboyanto-{width}x{height}.jpg,"['6ea6bca4-4712-4ab9-a906-e3336a9d8039', 'ac763b17-7bea-4632-9eb4-d106689ff409', '6606e54c-f92d-40f6-8257-74977889ccdd']",affiliate,Welcome to my channel! I'm a fairly new streamer who plays FIFA! Usually live on Wednesdays-Sundays at 10 CST!!,
40492035390,58004346,iAmBryanM,518204,FIFA 21,live,RECORD [18-3]  Continuamos! / Sorteo a los 500 seguidores!!/ !redes ,18,2020-11-15T02:27:20Z,es,https://static-cdn.jtvnw.net/previews-ttv/live_user_iambryanm-{width}x{height}.jpg,['d4bb9c58-2141-4881-bcdc-3fe0505457d1'],affiliate,Hola Buenas :),
40493432270,92793084,SoyLoveR,518204,FIFA 21,live,ESTE FUTCHAMPS ES EL MÁS DIFICIL! 15-5/ !redes !id ,18,2020-11-15T03:40:40Z,es,https://static-cdn.jtvnw.net/previews-ttv/live_user_soylover-{width}x{height}.jpg,['d4bb9c58-2141-4881-bcdc-3fe0505457d1'],affiliate,#LaCaraMasBellaDeFIFAEnTwitch / Ven y únete a la LoveRWave con los mejores directos de FIFA (y quizás algo más por allí).,
40493650478,463091309,bsc_novavida,518204,FIFA 21,live,Continuamos con Fut Champions (10-1)!!! ECU,17,2020-11-15T03:52:36Z,es,https://static-cdn.jtvnw.net/previews-ttv/live_user_bsc_novavida-{width}x{height}.jpg,['d4bb9c58-2141-4881-bcdc-3fe0505457d1'],affiliate,"Hola amigos, me presento mi nombre es Allan Suárez y soy jugador profesional Esports de Barcelona S.C Youtuber y Streamer en Twitch, Jugador Verificado de Ecuador  Si te suscribes a mi canal participarás en sorteos exclusivos y apoyo constante para mejorar tus habilidades en Fifa",
40492056734,410045102,Futshark,518204,FIFA 21,live,Weekend League with R9!!! Terrible Start Good Ending?,16,2020-11-15T02:28:28Z,en,https://static-cdn.jtvnw.net/previews-ttv/live_user_futshark-{width}x{height}.jpg,"['6ea6bca4-4712-4ab9-a906-e3336a9d8039', '4ada413e-c7c4-4fc0-b3d6-ce4b98e0d5e3']",affiliate,Hey Im Jesse I love to stream and make content for Fifa and Warzone! I enjoy scoring bangers and wiping full squads! Aiming to become an Elite Fifa player... Best Weekend League Record 23-7,
40494349566,437819615,mralfonso_11,518204,FIFA 21,live,[MEX-ESP] | 10 PARTIDOS DE CHAMPS Y A MIMIR! | EPISODIO 2 MI PAREJA IDEAL EN YOUTUBE USA EL COMANDO !Youtube | !discord,16,2020-11-15T04:29:54Z,es,https://static-cdn.jtvnw.net/previews-ttv/live_user_mralfonso_11-{width}x{height}.jpg,['d4bb9c58-2141-4881-bcdc-3fe0505457d1'],affiliate,Jugamos bastantes cosas.Asi que venga entra y dale follow!,
39716391997,59887353,TriadeFIFA,518204,FIFA 21,live,🔴PASSANDO FOME COM O TIME DO RIVER F 🇦🇷,16,2020-11-14T23:26:02Z,pt,https://static-cdn.jtvnw.net/previews-ttv/live_user_triadefifa-{width}x{height}.jpg,['39ee8140-901a-4762-bfca-8260dea1310f'],affiliate,"Psicólogo do Esporte, músico em hiato, atleta de Jiu-Jitsu aposentado e atualmente, treinador de jogadores de FIFA.",
39717366925,188551451,JoseNChill,518204,FIFA 21,live,I packed RTTF AUBAMEYANG! But... #FIFA21,16,2020-11-15T01:22:12Z,en,https://static-cdn.jtvnw.net/previews-ttv/live_user_josenchill-{width}x{height}.jpg,['6ea6bca4-4712-4ab9-a906-e3336a9d8039'],affiliate,"All the fun, not all of the skill! Wanna get to know me?Stick around and ask questions in the chat! Join the crew to check out my new adventures! I play mostly FIFA and throw in Among Us and other trending titles.",
40492364798,265762329,twwiin,518204,FIFA 21,live,FIFA 21 SHIT ULTIMATE TEAM,15,2020-11-15T02:44:55Z,en,https://static-cdn.jtvnw.net/previews-ttv/live_user_twwiin-{width}x{height}.jpg,"['6ea6bca4-4712-4ab9-a906-e3336a9d8039', 'e1a43486-eee5-4f36-9ee6-76e72af00180']",affiliate,"Im just a kid who plays games, you can see me playing Rocket League, Valorant, Overwatch, Siege, Deceit, Minecraft or just random games you want me to play like Hyper Scape or something new and fun. I’m always up for new experiences and meeting new people. Thanks for stopping by!",
39717710333,187492594,Pence2k,518204,FIFA 21,live,BECKHAM CONFIRMED! FUT Champs Night + NEW PLAYER!! | MAKE COINS HERE -> !bpm  - !merch !newvid,15,2020-11-15T02:00:45Z,en,https://static-cdn.jtvnw.net/previews-ttv/live_user_pence2k-{width}x{height}.jpg,['6ea6bca4-4712-4ab9-a906-e3336a9d8039'],affiliate,"Welcome to my channel! Streamer/Team Member of Reliance Gaming. Combination of FIFA 20 Ultimate Team and Pro Clubs! I stream every night at 9:30pm EST (2:30am UK), typically 3-5 hours per day, so make sure to follow and turn on notifications!",
39992893164,100921384,Bahamut_13,518204,FIFA 21,live,[PS4] Défi Correa,15,2020-11-15T00:00:55Z,fr,https://static-cdn.jtvnw.net/previews-ttv/live_user_bahamut_13-{width}x{height}.jpg,['6f655045-9989-4ef7-8f85-1edcec42d648'],affiliate,,
39993615068,452334462,dry_1eaf,518204,FIFA 21,live,"Первый в моей истории ""Буст"", главное не облажаться ...",14,2020-11-15T03:41:25Z,ru,https://static-cdn.jtvnw.net/previews-ttv/live_user_dry_1eaf-{width}x{height}.jpg,"['0569b171-2a2b-476e-a596-5bdfb45a1327', '4ada413e-c7c4-4fc0-b3d6-ce4b98e0d5e3', 'ff56eeeb-99ed-4a60-93fc-0b3f05d8661e']",affiliate,Привет дорогой зритель и спасибо что решил прочитать описание. Я буду ждать тебя на своих трансляциях каждый день!,
39718205037,122802761,brasil_raphael,518204,FIFA 21,live,Weekend League do Painaldo! 💥Lincoln tá de sacanagem!💥 SUBS 3X na LOJA!,14,2020-11-15T02:56:44Z,pt,https://static-cdn.jtvnw.net/previews-ttv/live_user_brasil_raphael-{width}x{height}.jpg,['39ee8140-901a-4762-bfca-8260dea1310f'],affiliate,"Um idiota do bem e apaixonado por games. Começando o canal focado em entreter a rapaziada com uma resenha de qualidade, interação total com o chat e gameplay duvidosa.",
39993674604,495173501,CyberLiveArena1,518204,FIFA 21,live,eFootball FIFA21 CyberLive!Arena,14,2020-11-15T04:23:37Z,en,https://static-cdn.jtvnw.net/previews-ttv/live_user_cyberlivearena1-{width}x{height}.jpg,"['6ea6bca4-4712-4ab9-a906-e3336a9d8039', '4ada413e-c7c4-4fc0-b3d6-ce4b98e0d5e3']",affiliate,https://linktr.ee/Cyber_live_arena,
39993465100,177446502,abouportant_,518204,FIFA 21,live,FUT CHAMPIONS AVEC UNE CO DEGUEULASSE ! ON VISE OR 3 ,14,2020-11-15T02:18:53Z,fr,https://static-cdn.jtvnw.net/previews-ttv/live_user_abouportant_-{width}x{height}.jpg,['6f655045-9989-4ef7-8f85-1edcec42d648'],affiliate,Spécialiste du beau jeu ! Fuck la grinta on n’est pas en MMA ,
40494763278,210476115,ZincTV,518204,FIFA 21,live,RTTF Low/Mid Budget Trading !filters,13,2020-11-15T04:53:12Z,en,https://static-cdn.jtvnw.net/previews-ttv/live_user_zinctv-{width}x{height}.jpg,['6ea6bca4-4712-4ab9-a906-e3336a9d8039'],affiliate,Welcome to my channel! I go by Zinc and I primarily play FIFA. Hope you enjoy yourself while you watch :),
39717851997,570858309,TomasMorini9,518204,FIFA 21,live,[ARG] Un ratito de lloros | !yt !ds !mp !help !autohost !grandt |,13,2020-11-15T02:16:11Z,es,https://static-cdn.jtvnw.net/previews-ttv/live_user_tomasmorini9-{width}x{height}.jpg,['d4bb9c58-2141-4881-bcdc-3fe0505457d1'],affiliate,Bienvenido! Espero que disfrutes de mi contenido!,
39716280445,207218417,baitzera_,518204,FIFA 21,live,Ultimate Team da DeepWeb - DME's e Divisão Raiva,13,2020-11-14T23:11:07Z,pt,https://static-cdn.jtvnw.net/previews-ttv/live_user_baitzera_-{width}x{height}.jpg,['39ee8140-901a-4762-bfca-8260dea1310f'],affiliate,,
39980921900,402461982,Dzejbrc,518204,FIFA 21,live,OBROVSKÝ 24+3H STREAM ZA SUBY 🔥⚡|VEČERNÍ WL | !program !digihry !dc,13,2020-11-14T09:55:49Z,cs,https://static-cdn.jtvnw.net/previews-ttv/live_user_dzejbrc-{width}x{height}.jpg,['a6cddaba-f0ce-4526-9087-6de2f603a24d'],affiliate,Český FIFA streamer ⚽🎥 Střihač videí 🔥Dreamer boy 😏,
39993143308,571080520,MrMashadi,518204,FIFA 21,live,FOKUS!!! - WL 18-6 - Road to Elite -  !instagram !youtube !watchtime,13,2020-11-15T00:45:08Z,de,https://static-cdn.jtvnw.net/previews-ttv/live_user_mrmashadi-{width}x{height}.jpg,['9166ad14-41f1-4b04-a3b8-c8eb838c6be6'],affiliate,"Ich streame Fifa 21 FUT - Pack Opening & SBC's, außerdem Fortnite & Fall Guys. Ab und zu auch einfach mal chatten.✌",
39718252317,248028620,sebas17twitch,518204,FIFA 21,live,FUT CHAMPIONS Y SOBRES DE IF GARANTIZADOS!EN DIRECTO Y SOBRES !DIRECTO- FIFA 21 CHILE !comandos ,13,2020-11-15T03:02:11Z,es,https://static-cdn.jtvnw.net/previews-ttv/live_user_sebas17twitch-{width}x{height}.jpg,['d4bb9c58-2141-4881-bcdc-3fe0505457d1'],affiliate,,
