id,user_id,user_name,game_id,game_name,type,title,viewer_count,started_at,language,thumbnail_url,tag_ids,broadcaster_type,description,type
40483690382,12826,Twitch,1956568859,GlitchCon,live,GlitchCon Afterparty • Hosted by T-Pain • GlitchCon,59935,2020-11-14T16:05:44Z,en,https://static-cdn.jtvnw.net/previews-ttv/live_user_twitch-{width}x{height}.jpg,"['6ea6bca4-4712-4ab9-a906-e3336a9d8039', 'c2542d6d-cd10-4532-919b-3d19f30a768b', '325f7a22-26f4-4ad7-be48-f464de0b89ce', 'c5247b10-deec-4d7a-84a5-db6a75cb5908', '1eba3cfe-51cc-460a-8259-bc8bb987f904', 'f317a85e-495e-4aee-a0d2-0720bd00a6ce', '8a01ea18-df97-4046-9cff-a9a822bb96e5']",partner,The main channel of The Glitch is here. Where is here? You're already there. What's in The Glitch? Things.,
40489237710,54868701,HighGai,1956568859,GlitchCon,live,"
【Co-Stream】Glitch-conがどんなイベントかみんなで見ちゃろう！！ 【JP/ENG】",620,2020-11-14T23:54:19Z,ja,https://static-cdn.jtvnw.net/previews-ttv/live_user_highgai-{width}x{height}.jpg,"['e027fb8b-219e-4959-8240-a4a082be0316', '396aee63-bb8a-43c4-95da-98fca08e144b', '81df4005-f654-40b2-9fc0-9fd767bc8e3e', 'cc8d5abb-39c9-4942-a1ee-e1558512119e', '6ba1d230-e52f-4d81-b1e0-41f25a8a9f5d', 'd0976a7e-26a7-4a48-9225-c522808540f2']",partner,ハイテンションガイジンがお送りするビデオゲームバラエティー！ Hightension Productions presents awesome Video Game and Variety Show!,
40493647710,120270943,TheUncleJoeShow,1956568859,GlitchCon,live,SLAM FEST 2006 - LETS GET DOWN ,148,2020-11-15T03:52:28Z,en,https://static-cdn.jtvnw.net/previews-ttv/live_user_theunclejoeshow-{width}x{height}.jpg,"['c2839af5-f1d2-46c4-8edc-1d0bfbd85070', '6ea6bca4-4712-4ab9-a906-e3336a9d8039']",partner,"Hello there, you may be confused but I'm your new online Uncle. It's just that simple, all the thrills of having a real family with none of the commitment. Grab yourself a glass of warm milk and chair because we're going to be here for a while. ",
40489217310,27929699,TMSean,1956568859,GlitchCon,live,FREE M+ 15-20 CARRIES - !Spin !Carry GLITCHCON,63,2020-11-14T23:52:57Z,en,https://static-cdn.jtvnw.net/previews-ttv/live_user_tmsean-{width}x{height}.jpg,['6ea6bca4-4712-4ab9-a906-e3336a9d8039'],partner,,
39718684301,89063060,chrstn,1956568859,GlitchCon,live,birthday countdown stream!!!,51,2020-11-15T03:57:53Z,en,https://static-cdn.jtvnw.net/previews-ttv/live_user_chrstn-{width}x{height}.jpg,"['6ea6bca4-4712-4ab9-a906-e3336a9d8039', 'c2839af5-f1d2-46c4-8edc-1d0bfbd85070']",affiliate,Hello! My name is Christian and I sing and whatnot.,
40490390638,94869865,zja2damax,1956568859,GlitchCon,live,Happy birthday chrstn | !hoodie !sub !socials !zjau !discord,50,2020-11-15T01:01:04Z,en,https://static-cdn.jtvnw.net/previews-ttv/live_user_zja2damax-{width}x{height}.jpg,['6ea6bca4-4712-4ab9-a906-e3336a9d8039'],partner,A man of Creativity & Aloha. May the Shaka Flex be with you.,
40484865774,93087523,Dizeliun,1956568859,GlitchCon,live,LIVE GlitchCon Battle Royale SpeedRun! || !dizcord !yt !tiktok,43,2020-11-14T18:13:57Z,en,https://static-cdn.jtvnw.net/previews-ttv/live_user_dizeliun-{width}x{height}.jpg,['6ea6bca4-4712-4ab9-a906-e3336a9d8039'],affiliate,Full-Time Liun 🦁Part-Time Streamer,
40495230014,254182243,TheComplements,1956568859,GlitchCon,live,GlitchCon Afterparty Watchparty,40,2020-11-15T05:20:28Z,en,https://static-cdn.jtvnw.net/previews-ttv/live_user_thecomplements-{width}x{height}.jpg,"['6ea6bca4-4712-4ab9-a906-e3336a9d8039', 'c5247b10-deec-4d7a-84a5-db6a75cb5908', '744f1c0b-458e-4a12-a759-bfa2edb7c81a', '60b8f13e-7022-481a-afff-07de3db129cc', '8c1ada77-52f0-4935-a1b0-a02dc65f28b4', '325f7a22-26f4-4ad7-be48-f464de0b89ce']",affiliate,"🤗😁 Greg & Aleesha here! Greg: classically trained pianist and self-taught guitarist. Aleesha: trained in everything else that Greg isn't. California, USA  http://www.songsfromhamilton.com",
40485578526,223634940,Rainlyte,1956568859,GlitchCon,live,GlitchCon // Welcome to the Coze-Zone Layer,35,2020-11-14T19:19:42Z,en,https://static-cdn.jtvnw.net/previews-ttv/live_user_rainlyte-{width}x{height}.jpg,"['6ea6bca4-4712-4ab9-a906-e3336a9d8039', 'adb55316-f1ab-4f81-9ff5-17da7719d0ee']",affiliate,"I broadcast variety streams with thoughtful and interactive commentary to a wholesome community. Details on my streaming approach, game rotation, and more in the panels below!",
40488816654,136489331,Okuri_1nu,1956568859,GlitchCon,live,Chilling ಠ_ಠ !creatortag,26,2020-11-14T23:26:06Z,en,https://static-cdn.jtvnw.net/previews-ttv/live_user_okuri_1nu-{width}x{height}.jpg,['6ea6bca4-4712-4ab9-a906-e3336a9d8039'],affiliate,,
40495313038,91501224,ZoRo491,1956568859,GlitchCon,live,(ENG/NP) Big WooOO with the usual + cod zombies or some game later 😈 l !socials,21,2020-11-15T05:25:39Z,en,https://static-cdn.jtvnw.net/previews-ttv/live_user_zoro491-{width}x{height}.jpg,['6ea6bca4-4712-4ab9-a906-e3336a9d8039'],affiliate,Hi i'm ZoRo from Nepal. I'm 22 and in college for my Finance Degree(Final Year). it just be a grind out here WooOO,
40483724958,91374839,MissJae,1956568859,GlitchCon,live,Will you be my Glitchcon Date? !discord !battle,19,2020-11-14T16:10:00Z,en,https://static-cdn.jtvnw.net/previews-ttv/live_user_missjae-{width}x{height}.jpg,"['6ea6bca4-4712-4ab9-a906-e3336a9d8039', 'adb55316-f1ab-4f81-9ff5-17da7719d0ee']",affiliate,"You may know me as MissJae, MissYay, DJMissJ or for the Beam.Pro/Mixer OG's I was MistressJ. I am a casual variety streamer who is bad at games, I die lots and I am colorblind. I am the derpy idiot in the room, But I still Have fun!",
40492703806,11320046,SNLabat,1956568859,GlitchCon,live,It's #GlitchCon! We're Celebrating With More Star Wars Games! Join In Chat!,15,2020-11-15T03:02:16Z,en,https://static-cdn.jtvnw.net/previews-ttv/live_user_snlabat-{width}x{height}.jpg,"['6ea6bca4-4712-4ab9-a906-e3336a9d8039', '26301bb2-91a3-4272-8a9b-5bcea6db0fcd']",affiliate,"A common man with uncommon sense playing and reviewing video games from all platforms, from all eras.   ",
40491913390,23515233,Frostfireee,1956568859,GlitchCon,live,GLITCH CON TALKING ABOUT GLITCHCON THINGS,13,2020-11-15T02:20:44Z,en,https://static-cdn.jtvnw.net/previews-ttv/live_user_frostfireee-{width}x{height}.jpg,"['8bbdb07d-df18-4f82-a928-04a9003e9a7e', '6ea6bca4-4712-4ab9-a906-e3336a9d8039']",affiliate,Finding this channel was a massive mistake,
39716295021,152327281,Bekaloo,1956568859,GlitchCon,live,(Female eivor playthru) No lifing the life of a viking / no cam :),11,2020-11-14T23:12:57Z,en,https://static-cdn.jtvnw.net/previews-ttv/live_user_bekaloo-{width}x{height}.jpg,['6ea6bca4-4712-4ab9-a906-e3336a9d8039'],affiliate,"Hi i'm Beka, right now I play a lot of DBD, OSRS, Apex and sometimes Overwatch. I also host food challenges!",
40495025854,103606615,ElMancoR,1956568859,GlitchCon,live,🤩 💖 HOY NOMAAAAS HECHALE CAPAZDELASIEERRA🤩 💖 ,11,2020-11-15T05:08:03Z,es,https://static-cdn.jtvnw.net/previews-ttv/live_user_elmancor-{width}x{height}.jpg,"['ac763b17-7bea-4632-9eb4-d106689ff409', 'ff56eeeb-99ed-4a60-93fc-0b3f05d8661e', '8ba227ca-073c-46a7-b3cc-193e52c5ab4d', '0cb7e377-a308-44e8-91f7-07eea1d96129', 'd4bb9c58-2141-4881-bcdc-3fe0505457d1', 'd4461e94-570b-4973-b6a1-3afe026c12ca']",affiliate,"Hola soy Rodrigo Segura, una persona soñadora UwU jaja Me dicen Borrego, Borre, Rodri o chino XD como gusten.Tengo 20 añitos, no puelo toy chikito UnU Soy de la ciudad de México. ahre como todo en bolilloMe gustas, digo me gustan los videojuegos desde chiquito, toda mi vida eh jugado videojuegos",
39719233965,478444365,Emechi_,1956568859,GlitchCon,live,PUBG con música de la GlitchCon Afterparty / Llegamos al 1k followers? [ 845/1000 ],11,2020-11-15T05:34:07Z,es,https://static-cdn.jtvnw.net/previews-ttv/live_user_emechi_-{width}x{height}.jpg,"['d4bb9c58-2141-4881-bcdc-3fe0505457d1', 'cc8d5abb-39c9-4942-a1ee-e1558512119e', 'adb55316-f1ab-4f81-9ff5-17da7719d0ee', 'ff56eeeb-99ed-4a60-93fc-0b3f05d8661e', 'f317a85e-495e-4aee-a0d2-0720bd00a6ce']",affiliate,"Es EMECHI,  no ""El Michi"" manga de forros /🔥WIHKANDA FOREVER❄️",
39715831261,25893986,Marscall,1956568859,GlitchCon,live,[EN/ES] GLITCHCON Co-stream - ME REGALARON 100 SUBS 🔴 !discord !clip en chat 🎬,10,2020-11-14T22:11:15Z,es,https://static-cdn.jtvnw.net/previews-ttv/live_user_marscall-{width}x{height}.jpg,"['d4bb9c58-2141-4881-bcdc-3fe0505457d1', 'e027fb8b-219e-4959-8240-a4a082be0316', 'ac763b17-7bea-4632-9eb4-d106689ff409', '396aee63-bb8a-43c4-95da-98fca08e144b', 'adb55316-f1ab-4f81-9ff5-17da7719d0ee']",affiliate,🔴 Welcome to Mars,
40492224286,79135520,True_Schu,1956568859,GlitchCon,live,WHAT UP THO!    **SELLOUT MENU %50 OFF** !discord @True_Schu,9,2020-11-15T02:37:14Z,en,https://static-cdn.jtvnw.net/previews-ttv/live_user_true_schu-{width}x{height}.jpg,"['6ea6bca4-4712-4ab9-a906-e3336a9d8039', 'ff56eeeb-99ed-4a60-93fc-0b3f05d8661e', '8486f56b-8677-44f7-8004-000295391524', '0cb7e377-a308-44e8-91f7-07eea1d96129']",affiliate,WELCOME TO ALL!!  ,
39993670972,45840287,ChokeN_RL,1956568859,GlitchCon,live,WE LOVE GLITCHCON <3,9,2020-11-15T04:21:08Z,en,https://static-cdn.jtvnw.net/previews-ttv/live_user_choken_rl-{width}x{height}.jpg,['6ea6bca4-4712-4ab9-a906-e3336a9d8039'],affiliate,21.,
39719129149,191949184,StratBecker,1956568859,GlitchCon,live,BRINGING STOCKS TO THE ATRIOC SMP,9,2020-11-15T05:12:32Z,en,https://static-cdn.jtvnw.net/previews-ttv/live_user_stratbecker-{width}x{height}.jpg,"['67259b26-ff83-444e-9d3c-faab390df16f', '6ea6bca4-4712-4ab9-a906-e3336a9d8039']",affiliate,"Content creator for the masses. YouTuber, gamer, and trader. Let's add streamer to that too",
40494654302,42807555,TractorTaylor,1956568859,GlitchCon,live,"Waiting for Glitchcon Hype!
",8,2020-11-15T04:46:55Z,en,https://static-cdn.jtvnw.net/previews-ttv/live_user_tractortaylor-{width}x{height}.jpg,['6ea6bca4-4712-4ab9-a906-e3336a9d8039'],affiliate,Just Some Nerd With A Captains Hat that Loves Tractors,
40493387470,423877959,hcproteus,1956568859,GlitchCon,live,GlitchCon is here!,7,2020-11-15T03:38:18Z,en,https://static-cdn.jtvnw.net/previews-ttv/live_user_hcproteus-{width}x{height}.jpg,"['6ea6bca4-4712-4ab9-a906-e3336a9d8039', 'f317a85e-495e-4aee-a0d2-0720bd00a6ce', 'a005b174-b20e-46b1-8679-4589fef81c8e']",affiliate,"Hi! My name's Matt, and welcome to my Twitch channel! My main interests are video games, hockey, rock music, sci-fi movies, and reality tv shows. I am a 19 year old college student living in Canada, and I usually stream retro games & party games in my spare time. I hope you enjoy your time here!",
40488703374,138854204,realpikachugamer,1956568859,GlitchCon,live,(Prism INC/Team Sapphire) GlitchPika And Pika Raiders While Bein An Adorable V-Cat Girl/ Pikachu~ !commands #PushForPartner,7,2020-11-14T23:18:02Z,en,https://static-cdn.jtvnw.net/previews-ttv/live_user_realpikachugamer-{width}x{height}.jpg,"['6ea6bca4-4712-4ab9-a906-e3336a9d8039', '8bbdb07d-df18-4f82-a928-04a9003e9a7e', '67259b26-ff83-444e-9d3c-faab390df16f', 'ac763b17-7bea-4632-9eb4-d106689ff409', 'f317a85e-495e-4aee-a0d2-0720bd00a6ce']",affiliate,"Full Time Variety Female LGBTQIA+ Affiliate Streamer, Great Friends w/ Shockburn, Asukaa5, Lay_Xe and many others (Check Friends Panel), My Dragon King💙💜- RyuKoriYami, Pikachu Fan, Furry, Artist, Gamer, Singer, VRChat/Neos/ChilloutVR Player, Member Of Prism INC And Team Sapphire Stream Teams",
40493941710,39143055,GamerDoll,1956568859,GlitchCon,live,let's kick it & watch the tpain after party,7,2020-11-15T04:07:46Z,en,https://static-cdn.jtvnw.net/previews-ttv/live_user_gamerdoll-{width}x{height}.jpg,['6ea6bca4-4712-4ab9-a906-e3336a9d8039'],affiliate,:],
40484051550,104142937,Katamew,1956568859,GlitchCon,live,(   ˙ ꒳ ​˙ ) Let's watch GlitchCon???? [ !realm !goal !discord ],7,2020-11-14T16:50:07Z,en,https://static-cdn.jtvnw.net/previews-ttv/live_user_katamew-{width}x{height}.jpg,['6ea6bca4-4712-4ab9-a906-e3336a9d8039'],affiliate,"♡ Hello!! ♡ My name is Kat! I'm a variety streamer who has a passion for games, kitties, and chicky tendies! ",
39715615597,75451456,GoblinKing2Cynn,1956568859,GlitchCon,live,GG= Glitchcon and Gamin!!!  #MyVPisBlack #FollowthatGoblinTrain #TwitchSIE #Dayof28Fasting,5,2020-11-14T21:41:09Z,en,https://static-cdn.jtvnw.net/previews-ttv/live_user_goblinking2cynn-{width}x{height}.jpg,"['6ea6bca4-4712-4ab9-a906-e3336a9d8039', '6606e54c-f92d-40f6-8257-74977889ccdd', 'b2c03e34-e7c2-4fcd-939a-6853838edce5', 'adb55316-f1ab-4f81-9ff5-17da7719d0ee', 'd557fc7d-23da-48aa-87a4-35877fd57646']",affiliate,Just a family trying to bond over Games and Vlogs **May be some colorful language on occasion** any donations please send here https://streamlabs.com/goblinking2cynn,
40495211502,79621996,GATOATTACK,1956568859,GlitchCon,live,(EN/SP) XQC DID WHAT!?!? THE AFTERMATH!!! BEEEF!!! #GlitchCon,4,2020-11-15T05:19:15Z,es,https://static-cdn.jtvnw.net/previews-ttv/live_user_gatoattack-{width}x{height}.jpg,"['338d7a92-8bcc-429e-a30c-9f1c41a2d79a', '96b6073f-450d-4248-8ed4-988e28f3f759', 'ac763b17-7bea-4632-9eb4-d106689ff409', 'd4bb9c58-2141-4881-bcdc-3fe0505457d1', 'ff56eeeb-99ed-4a60-93fc-0b3f05d8661e']",affiliate,Bilingual Content Creator | Variety Streamer | Commentator Youtuber,
39713965453,163387274,Crumbz3DmTv,1956568859,GlitchCon,live,GLITCHCON 2020 Lets get it!! Tarkie tark later!! LEGGO  | 112/200 sub goal  #PathToPartner  !twitter !instagram !discord !chair !fleamarket,4,2020-11-14T17:49:53Z,en,https://static-cdn.jtvnw.net/previews-ttv/live_user_crumbz3dmtv-{width}x{height}.jpg,"['6ea6bca4-4712-4ab9-a906-e3336a9d8039', 'adb55316-f1ab-4f81-9ff5-17da7719d0ee', 'f317a85e-495e-4aee-a0d2-0720bd00a6ce']",affiliate,I'm a Glover who loves playing video games with his homies!!!! Come hang out and watch some average gameplay!!! ,
40472141102,264976441,lampy710,1956568859,GlitchCon,live,Lets kick it & vibe 🌌 - song requests !sr 🎵 - 420 dank sesh 🔥🪴💨,4,2020-11-13T23:55:55Z,en,https://static-cdn.jtvnw.net/previews-ttv/live_user_lampy710-{width}x{height}.jpg,"['6ea6bca4-4712-4ab9-a906-e3336a9d8039', 'ab45fcb7-a22d-4a07-b0ac-fb3940566fa7', 'c5247b10-deec-4d7a-84a5-db6a75cb5908', 'b76cb377-f766-48a7-b148-88bcb3932017']",affiliate,"HII my name is Justen, I'm 25. I live in California a legal medicinal cannabis state. My stream mainly consists of Just Chatting and PC and Play Station gaming. Daily streams live of my everyday life and  including some fun events and ideas! Thank You for joining enjoy the stay!",
40494851006,141787906,verified37,1956568859,GlitchCon,live,"GLITCHCON VIEWING AND DRINKING / EVERY NEW FOLLOW = 1 SHOT
",3,2020-11-15T04:58:15Z,en,https://static-cdn.jtvnw.net/previews-ttv/live_user_verified37-{width}x{height}.jpg,"['6ea6bca4-4712-4ab9-a906-e3336a9d8039', 'd33671c6-d05b-44a6-a548-5d5930365882', 'f317a85e-495e-4aee-a0d2-0720bd00a6ce']",affiliate,My name is Bryce most people call me verified. I'm just a 21 year old trying to make it huge on twitch,
40489755918,169463883,monster_cal,1956568859,GlitchCon,live,Deady Quads -Follow 4 Follow -  ROAD TO 50 FOLLOWERS - ,2,2020-11-15T00:24:56Z,en,https://static-cdn.jtvnw.net/previews-ttv/live_user_monster_cal-{width}x{height}.jpg,['6ea6bca4-4712-4ab9-a906-e3336a9d8039'],,Just a dude that likes videos games and wants to share with the world :),
39717959293,434888643,Gallag11er,1956568859,GlitchCon,live,GLITCHGAL for realz! 🩺 never too old to learn something new!! follow Gallag11er to join the Gal Pal community 💋 !SOCIAL ,2,2020-11-15T02:28:15Z,en,https://static-cdn.jtvnw.net/previews-ttv/live_user_gallag11er-{width}x{height}.jpg,"['8bbdb07d-df18-4f82-a928-04a9003e9a7e', 'ad18ee82-c0b2-46d4-b4f9-d45994443bd7', '6ea6bca4-4712-4ab9-a906-e3336a9d8039', '27937cec-5cfc-4f56-b1d3-f6e1d67735e2', '96b6073f-450d-4248-8ed4-988e28f3f759', 'fd8f5e68-42d3-4544-a273-5fc92dabc568']",affiliate,💜 FOLLOW to be a Gal Pal 💖,
39715367981,81359366,tehdcfresh,1956568859,GlitchCon,live,TFT and Glitchcon 2020,2,2020-11-14T21:05:29Z,en,https://static-cdn.jtvnw.net/previews-ttv/live_user_tehdcfresh-{width}x{height}.jpg,"['6ea6bca4-4712-4ab9-a906-e3336a9d8039', 'a005b174-b20e-46b1-8679-4589fef81c8e', 'adb55316-f1ab-4f81-9ff5-17da7719d0ee', 'e1a43486-eee5-4f36-9ee6-76e72af00180', '1eba3cfe-51cc-460a-8259-bc8bb987f904']",,,
39719187117,165107934,GAMESTANCE,1956568859,GlitchCon,live,THE GET LIT SHOW  | THE LATE NIGHT CHILL | #GLITCHCON,2,2020-11-15T05:24:26Z,en,https://static-cdn.jtvnw.net/previews-ttv/live_user_gamestance-{width}x{height}.jpg,"['6ea6bca4-4712-4ab9-a906-e3336a9d8039', '338d7a92-8bcc-429e-a30c-9f1c41a2d79a', '4d580385-6b91-4cee-aedf-0d79ea956694', 'f7c66388-34d7-4ac7-b171-b6a18053cae9', '9f1b01a8-87b9-4e25-94de-8705c1c1f4dc', 'd81d54c8-d705-4df6-aaf0-01d715c1dbcc']",affiliate,"GAMESTANCE.NET | VARIETY STREAMER. BOSTON, USA.",
39993726876,488437097,Kozabyte_,1956568859,GlitchCon,live,GlitchCon Afterparty Then BO3,2,2020-11-15T05:06:00Z,en,https://static-cdn.jtvnw.net/previews-ttv/live_user_kozabyte_-{width}x{height}.jpg,['6ea6bca4-4712-4ab9-a906-e3336a9d8039'],affiliate,I play video games.,
39993236460,508409302,jackpotjacksons1,1956568859,GlitchCon,live,GlitchCon LIVE!!!,2,2020-11-15T01:06:04Z,en,https://static-cdn.jtvnw.net/previews-ttv/live_user_jackpotjacksons1-{width}x{height}.jpg,['6ea6bca4-4712-4ab9-a906-e3336a9d8039'],affiliate,"BRAND NEW TO TWITCH SO HERE GOES... Hi, my name's Jackpot. I'm a dad, married, student studying social science, recovering alcoholic, and ex-con from my teenage years. As I drank for over 10 years and was in jail as a kid I want to pay back something to the world so I am going to be a support worker",
40484931630,467972200,OmaOGgamer711,1956568859,GlitchCon,live,Twitch Rivals ] 4:20MST - Super Team Showdown ft. VALORANT ] 7:10 MST - Super Team Showdown ft. Fall Guys ] 8:30 MST Finals,2,2020-11-14T18:20:27Z,en,https://static-cdn.jtvnw.net/previews-ttv/live_user_omaoggamer711-{width}x{height}.jpg,"['6ea6bca4-4712-4ab9-a906-e3336a9d8039', 'adb55316-f1ab-4f81-9ff5-17da7719d0ee', 'b13ce7d5-d513-49ff-a957-76f193df42aa']",,"Grandmas can game too! I'm not a pro gamer or anything, but I can hold my own. I usually come in at least in the top half of my online parties. I play games like, Call of Duty/Warzone, RDR, and The Last of Us.  I play primarily on PC with a Scuf controller, and sometimes PS4.  ~ Oma :)",
40483730014,89817634,Androssee,1956568859,GlitchCon,live,#GlitchCon After-Party!!!! @Androsseee on Twitter!,1,2020-11-14T16:10:36Z,en,https://static-cdn.jtvnw.net/previews-ttv/live_user_androssee-{width}x{height}.jpg,"['6ea6bca4-4712-4ab9-a906-e3336a9d8039', 'adb55316-f1ab-4f81-9ff5-17da7719d0ee']",affiliate,I'm just trying to grow a community where everyone can be themselves and have some laughs along the way♥,
39993757068,436171980,Driantx,1956568859,GlitchCon,live,GLITCHCON  !!!! CoStream ! pásate a comentarlo  We need cam ;(,1,2020-11-15T05:32:46Z,es,https://static-cdn.jtvnw.net/previews-ttv/live_user_driantx-{width}x{height}.jpg,['d4bb9c58-2141-4881-bcdc-3fe0505457d1'],affiliate,,
40495149854,485954666,TheJaxStash,1956568859,GlitchCon,live,First Campaign Playthrough! Cold War - !prime !lurk !420 !merch (PS4 Pro English),1,2020-11-15T05:15:25Z,en,https://static-cdn.jtvnw.net/previews-ttv/live_user_thejaxstash-{width}x{height}.jpg,"['6ea6bca4-4712-4ab9-a906-e3336a9d8039', '96b6073f-450d-4248-8ed4-988e28f3f759', '8ba227ca-073c-46a7-b3cc-193e52c5ab4d', 'fd8f5e68-42d3-4544-a273-5fc92dabc568', 'ff56eeeb-99ed-4a60-93fc-0b3f05d8661e', 'ac763b17-7bea-4632-9eb4-d106689ff409']",affiliate,"If you Like: IRL Streams, Video Games, Stupid Humor then this Stream is for You! Positivity and Chill Vibes Only!",
39981645100,473826867,Magnusnordic,1956568859,GlitchCon,live,[Co-streammer] after perty,1,2020-11-14T11:16:36Z,en,https://static-cdn.jtvnw.net/previews-ttv/live_user_magnusnordic-{width}x{height}.jpg,"['adb55316-f1ab-4f81-9ff5-17da7719d0ee', '63e83904-a70b-4709-b963-a37a105d9932', '6ea6bca4-4712-4ab9-a906-e3336a9d8039']",,"Hej Jeg hedder Magnus, men går under navnet Magnusnordic. Jeg elsker og stream til jer seere fra min efterskole eller der hjemme hos min familie. Så fin en cola eller noget andet og nyd min stream",
39718911997,99026262,yokaiartist,1956568859,GlitchCon,live,Doodling and watching glitch con (no mic),1,2020-11-15T04:32:32Z,en,https://static-cdn.jtvnw.net/previews-ttv/live_user_yokaiartist-{width}x{height}.jpg,['6ea6bca4-4712-4ab9-a906-e3336a9d8039'],affiliate,"Just a normal person who love video games!  Also, love to draw whenever I have the chance!!! ^_^",
40495015118,228484783,sharqq2,1956568859,GlitchCon,live,"watching glitchcon, scuffed hair streamer!!| 128/200 followers | 16/25 SUBS | ",1,2020-11-15T05:07:26Z,en,https://static-cdn.jtvnw.net/previews-ttv/live_user_sharqq2-{width}x{height}.jpg,['6ea6bca4-4712-4ab9-a906-e3336a9d8039'],affiliate,"Mainly marbles on stream streamer, but will occasionally switch it up! I STREAM DAILY! follow",
40494598142,140383230,adelmo_z,1956568859,GlitchCon,live,Glitchcon - yakuza 200% end - naruto Shippuden story fight game,1,2020-11-15T04:43:37Z,en,https://static-cdn.jtvnw.net/previews-ttv/live_user_adelmo_z-{width}x{height}.jpg,"['6ea6bca4-4712-4ab9-a906-e3336a9d8039', 'c67e3f4d-200f-4f75-a836-0420616054a7', 'adb55316-f1ab-4f81-9ff5-17da7719d0ee', 'ef4f33d5-a6cb-4935-bc1d-97c818a1e39e', 'e659959d-392f-44c5-83a5-fb959cdbaccc', '7cefbf30-4c3e-4aa7-99cd-70aabb662f27']",affiliate,"Hey guys. I'm adelmo. Welcome to our room. A variety speedrunner with yakuza kiwami 1, resident evil 5, etc You can find many different topics every day. Vrchat is amazing and the variety of people in the world as well. I'm sorry If sometimes I just forgot your messages. Let's go.",
39993753516,231939708,TheTEXTMan,1956568859,GlitchCon,live,INFO FOR  GlitchCon 2020  2 day ivente's,1,2020-11-15T05:29:34Z,ru,https://static-cdn.jtvnw.net/previews-ttv/live_user_thetextman-{width}x{height}.jpg,['0569b171-2a2b-476e-a596-5bdfb45a1327'],,"Я Владимир, играю в игры в основном ЭТО Dota 2 & CS:GO. А так ты не стесняйся фоловся и оставайся снами! x_X",
40484688190,69374159,throwdre,1956568859,GlitchCon,live,Testing Co-Streaming,1,2020-11-14T17:57:46Z,en,https://static-cdn.jtvnw.net/previews-ttv/live_user_throwdre-{width}x{height}.jpg,"['6ea6bca4-4712-4ab9-a906-e3336a9d8039', 'adb55316-f1ab-4f81-9ff5-17da7719d0ee', 'f317a85e-495e-4aee-a0d2-0720bd00a6ce']",,,
39985588076,475420119,lewisdoeseverything_th,1956568859,GlitchCon,live,G11tch T  1  3 3 | glitchcon 2020,1,2020-11-14T16:07:27Z,en,https://static-cdn.jtvnw.net/previews-ttv/live_user_lewisdoeseverything_th-{width}x{height}.jpg,"['6ea6bca4-4712-4ab9-a906-e3336a9d8039', 'adb55316-f1ab-4f81-9ff5-17da7719d0ee']",,Hi my name is lewis and I make streams,
39719173037,480674079,cr4pstar,1956568859,GlitchCon,live,stuff,1,2020-11-15T05:21:31Z,en,https://static-cdn.jtvnw.net/previews-ttv/live_user_cr4pstar-{width}x{height}.jpg,"['6ea6bca4-4712-4ab9-a906-e3336a9d8039', 'ac763b17-7bea-4632-9eb4-d106689ff409']",affiliate,"Cr4pstar's the name and playing crappy is the game....I play CS-GO (some what ok) Modern warfare (ok also), 7days to Die (better), Minecraft (i mean can you be bad at this), also Apex, Hunt:Showdown, Elder Scrolls, Deadside, and of course Rocket League fairly new to it.I dig gaming and joking ",
